None	Американцы стали массово удалять Uber, за то, что сервис вроде как наживался на антитрамповских протестах (хотя не факт!). Теперь многие переходят на приложение Lyft, не подозревая о том, что один из его инвесторов напрямую спонсировал избирательную кампанию Трампа. 
None	Дефэбио опубликовала фотографию с названием сериала в твиттере, и сразу после этого пилот объявил, что самолет входит в зону турбулентности.
None	ЦБ отозвал лицензию у Татфондбанка, занимавшего 42-е место в России. Вместе с ним лицензии лишились казанские Интехбанк и Анкор Банк, который принадлежит основателю кондитерской фабрики "А.Коркунов" 
None	Такое ощущение, что отношения между РФ и Белоруссией портятся с каждым часом(
None	Просто что-то невероятное. 
None	Канал CNN выяснил, что бывший посол США в Китае (назначенный Обамой) и бывший губернатор Юты Джон Хантсмен может стать послом в России.Сейчас Вашингтон в Москве представляет Джон Теффт, до этого работавший на Украине, в Грузии и в Литве. Его предшественнику Майклу Макфолу запретили въезд в Россию.
None	Довольно невероятная история. Главу Twitter не позвали на встречу с Трампом из-за ЭМОДЗИ! Нет, серьезно. Американская политика, 2016 год. Представьте себе новость: Владимир Путин отказался встречаться с Алишером Усмановым, потому что «ВКонтакте» отказался сделать стикер 
None	В слове года 51 буква (или 52)
None	День Водопроводчика
None	Два человека — Александр Филинов и Константин Тепляков — были арестованы в ноябре, как и Владимир Аникеев. Как и он, они обвиняются в незаконном доступе к компьютерной информации 
None	Как власти Барселоны пытаются защититься от туристов, которых в год приезжает в 20 раз больше, чем в городе живет людей.
None	Ситуация!
None	!! 
None	Человек ехал из Латвии в Удмуртию, в результате драки в поезде потерял память, оказался в Абхазии, а спустя более 20 лет попал в ДТП и все вспомнил
None	Попросили учесть общественную опасность действий девушки
None	Ну и совсем коротко
None	Доброе утро!
None	Мода на 90-е акцентированно возрождалась столько раз, что уже перестала быть ностальгической — в этом, собственно, и дело: «Грибы» и Луна отказываются от условностей, кавычек и подмигиваний, которыми было до поры свойственно обставлять соответствующие цитаты и отсылки. Здесь нет игры и демонстративного постмодернизма вроде «ну, мы-то с вами знаем»; вместо этого — живая жизнь и завидная буквальность: «да, мы такие и есть». Как раз это может вызвать (и вызывает) понятные возражения в российском хип-хоп-сообществе: «Грибы» сдают назад в жанре, который движется вперед куда активнее, чем любая другая музыка на русском языке; вместо того, чтобы повышать планку, как это здесь принято, «Грибы», пританцовывая, проходят под ней на полусогнутых.
None	Навальный: Дмитрий Медведев - коррупционер.Пресс-служба Д.Медведева: А Навальный сам уголовник!
None	Закон получила название «закон Тьюринга» в честь ученого Алана Тьюринга, который в 1952 году был осужден за связь с мужчиной и вскоре покончил с собой. Он был посмертно помилован королевой Елизаветой II в 2013 году
None	Представьте, вы сидите в номере отеля, допиваете утренний кофе и собираетесь на прогулку. Подходите к двери, дергаете ручку, дверь не открывается. Звоните на ресепшн — оказывается, хакеры взломали систему управления отелем и заблокировали замки. Одни постояльцы безуспешно пытаются выбраться из своих номеров, другие так же безуспешно пытаются войти в комнаты.Примерно так себе представляли журналисты то, что случилось в австрийском отеле утром 27 января. Но все оказалось несколько прозаичнее — хотя отель хакеры действительно взломали.
None	На Мирзаева напали ночью. По неподтвержденным данным, в него стреляли из трамватического оружия
None	«Журналисты или родственники могут разгласить гостайну, не имея при этом оформленного в установленном порядке допуска к таким сведениям. Отец погибшего солдата в интервью рассказал об обстоятельствах гибели сына — не окажется ли засекреченной эта информация?»
None	«На многое повлияла и новая Конституция, которую приняли в 1993 году. В советское время у нас было право на труд и обязанность трудиться. Бродского сажали за тунеядство, Цой работал кочегаром, чтобы не быть тунеядцем. А сегодня можно лежать на диване, проедать наследство, вообще нигде не работать, и ответственности за это нет никакой, потому что свобода труда закреплена Конституцией. Статья 37-я: „Труд свободен“. У нас теперь не право на труд, а право на свободный труд, то есть право на занятие той деятельностью, которую ты сам выбираешь».Доктор юридических наук, профессор, заведующим кафедрой трудового права юрфака МГУ и соавтор современного российского Трудового кодекса Александр Куренной рассказал журналистке «Медузе» Саше Сулим, что советского в нынешних отношениях работников и работодателей, как у нас обстоят дела с правами женщин и почему льготы — это не всегда хорошо.
None	Встретились два одиночества
None	На видео предположительно изображены военные полицейские на базе в Ханкале перед командировкой в Сирию
None	Президент российского Фонда культуры режиссер Никита Михалков заявил, что деятельность «Ельцин-центра» разрушает национальное самосознание детей, так как дает необъективную оценку истории России. В «Ельцин-центре», по мнению Михалкова, «ежедневно происходит инъекция разрушения национального самосознания детей». 
None	Ранее Верховный суд постановил, что правительство не может запускать процедуру выхода из ЕС без одобрения парламента, несмотря на результаты референдума. 1 февраля парламентарии предварительно одобрили законопроект — за проголосовали 498 человек, против — 114.
None	Разбираемся, из-за чего могли поссориться Россия и Белоруссия. Точнее Владимир Путин и Александр Лукашенко
None	Оочень милый зверь, кем бы он ни был
None	Задержанные сегодня полицейские из управление по борьбе с коррупцией оказались организаторами громкого дела двухлетней давности — тогда сообщалось, что бывший директор группы «Земляне» (!) с сообщником пытались продать основателю Qiwi (!!) пост в руководстве «Единой России» (!!I). Обвиняемых посадили на несколько лет, но в начале этого года дело отправили на пересмотр. Задержанных полицейских подозревают в провокации и фальсификации доказательств
None	Незаменимая услуга для начинающих звезд инстаграма
None	Нереально крутые фотографии колец Сатурна!
None	На прошлой неделе Трамп подписал указ о сокращении федерального финансирования городов, которые отказываются выдавать миграционной службе нелегалов (если те не совершили преступлений). Сан-Франциско считает, что это противозаконный указ.«Решение подать иск — непростой шаг. Но он необходим для защиты людей в этом городе, штате и стране от произвола со стороны президента, в чьих словах и действиях пока было видно мало уважения к нашей Конституции и верховенству закона», — заявил прокурор.
None	Коротко: остеопатия и хиропрактика — не особенно эффективные направления улучшить свое здоровье, если судить по исследованиям. Но если помогает — можно использовать для лечения всяких неприятностей с опорно-двигательным аппаратом. И еще: врачи предупреждают, что есть разные противопоказания. И остеопатию и хиропрактику нельзя применять как единственное средство. Такие дела.
None	Жутковатая фотогалерея из Авдеевки и Донецка, где снова стреляют с обеих сторон. 
None	Дорожку для губернатора постелили в апшеронском воздухоопорном спортивном комплексе, который был торжественно открыт в декабре 2011 года, но через месяц был закрыт и работу так и не возобновил.
None	Установить высокий налог на сверхдоходы, мелких предпринимателей освободить от налогов, на роскошно живущих чиновников, которые не могут объяснить происхождение своих доходов — заводить уголовные дела, передать бюджеты из Москвы регионам, преодолеть международную изоляцию России, ввести визовый режим со странами Средней Азии, лишить силовиков полномочий для давления на бизнес.Важнейшие тезисы предвыборной программы Алексея Навального:
None	Две недели назад мы обнаружили одинаковые новости про будущие выборы президента на «Дожде», в РБК, «Комсомольской правде» и «Лайфе» и удивились — кажется, раньше в администрации президента (откуда явно исходила информация) так грубо не работали. Удивились — и решили выяснить, как изменились методы администрации президента с приходом туда новых людей, прежде всего — Сергея Кириенко, который теперь курирует всю внутреннюю политику в стране.Спецкор Жегулев поговорил с самыми разными источниками и узнал много интересного. Например, что у Кириенко уже успел случиться конфликт с его предшественником Вячеславом Володиным, который теперь председательствует в Госдуме
None	Минкульт и Фонд кино обсуждают новую инициативу против западного кино и вроде как в поддержку нашего. Сэм Клебанов рассказал нашим друзьям из [club108468|КиноПоиска], что с этим не так:— Я же был на теледебатах, где участвовали Мизулина, Милонов и так далее. Они все несут какую-то ахинею, основанную на собственных представлениях о реальности, на предрассудках, но не могут подтвердить это фактами, научными исследованиями, статистикой. А им это и не надо. Они живут в мире «альтернативных фактов». Они свое мнение превращают в факты. Вот они подумают: «Ну, возьмем мы с каждого фильма по 5 млн рублей, а сколько у нас фильмов выходит? Четыреста в год? Это же 2 млрд рублей! Пусть голливудские кровососы заплатят!»
None	В процессе подготовки ролика про патриарха Кирилла и лайки, к видео с главой РПЦ (случайно, честное слово!) подцепились субтитры от ролика, где Сергей Шнуров читал стихотворение про Исаакиевский собор. И это очень смешно, простите
None	Роскомнадзор попытался внести в реестр запрещенных сайтов IP-адрес 127.0.0.1. Этот IP-адрес носит название localhost и применяется для обращения компьютера к самому себе.Что может быть тяжелее борьбы с самим собой.
None	Занятие на вечер.Старинные письма разбирать интересно, но не так-то просто понять, что там написано. Особенно, если автор пользовался старой орфографией — с ятями и ерами
None	ЛНР и ДНР решили самостоятельно управлять предприятиями Рината Ахметова на своей территории. То есть вроде как и не отбирать заводы, но налоги с них отчислять в свою казну. Между тем, с украинской стороны тоже нарастает напряженность, там неизвестные люди атаковали активистов, которые обеспечивают ж/д блокаду Донбасса. МВД грозится разогнать всех силой, но решение пока не принято
None	В Москве обыскивают музей Николая Рериха. Изъято уже более 200 экспонатов. Администрация называет происходящее «разрушением музея».
None	Привет, потомки! Ну как вы там?
None	Рассказываем, как готовить панфорте, трюфель, пряники и фондан 
None	Сардэчна запрашаем!
None	Анкета кандидата в президенты Навального. Само собой, такие анкеты у нас будут появляться про всех кандидатов (когда появятся сами кандидаты).
None	Славные традиции русской дипломатической школы
None	Вопрос о передаче Исаакиевского собора РПЦ предложили решить на референдуме. Вспоминаем, как это вообще бывает, особенно в России
None	Похоже, карьера Александра Поветкина завершится досрочно
None	В США всё норм, на очереди Франция
None	АААААААА! Курица-патриот! post,928300,Жутковатая фотогалерея из Авдеевки и Донецка, где снова стреляют с обеих сторон. 
None	Досуг сотрудников ФСБ
None	!! Решение принято для «создания необходимых условий охраны государственной границы РФ»
None	Главный блокбастер недели. Чеченцы, которые пытаются сбежать от Кадырова через Брест. Текст, за который депутат Милонов потребовал проверить «Медузу» на экстремизм. 
None	В январе анархисты захватили пустующий лондонский дом, который бывший топ-менеджер «Газпрома» Андрей Гончаренко купил в 2014 году. В доме сквоттеры решили устроить приют для бездомных, но во вторник суд обязал их освободить здание
None	Хорошие новости уже с утра! SpaceX возобновляет запуски Falcon 9. Первый – в воскресенье
None	«Мои сыновья — молодцы, очень успешные бизнесмены, я тут ни при чем. Зачем их переименовали в ЛСДУ3 и ЙФЯУ9, не знаю. Я человек православный. Каждому воздастся».Кратчайший пересказ большого интервью Юрия Чайки:
None	Мы уже рассказывали про Меланию Трамп — жену нового президента США, а теперь настала очередь его дочери от первого брака. Дональд Трамп, говоря об Иванке, часто позволял себе довольно странные заявления — например, говорил, что она «жопастая», хвалил ее грудь и тело, и намекал, что с радостью встречался бы с ней, если бы не возраст и не семейные связи. Иванку такие заявления всегда смущали, да и вообще она, похоже, не разделяет радикальные взгляды отца. А ее муж Джаред Кушнер считается одним из немногих людей, кто способен повлиять на Трампа в лучшую сторону.
None	Кто упустил наш тест про рэпчик, наверстывайте упущенное. Умственный труд бодрит! Что немаловажно для утра понедельника
None	Навальный и Офицеров теперь ничего не должны компании «Кировлес»
None	Пока лучшая новость этого понедельника. Освободили воспитательницу из Катайска Евгению Чудновец, которая перепостила видео с издевательствами над ребенком, тем самым помогла наказать садистов, а потом была осуждена за этот ролик сама.
None	Главная тема выходных. Тысяча паломников, споры о достоверности чуда и, разумеется, первенство шуток о том, что еще может замироточить
None	Помните эти объявления в самолетах, что 2016 год был годом российского кино? У нас для вас две новости: 1) это закончилось и 2) вот для чего это было 
None	Адская история этой недели. Полвека назад жительница поселка Ярково вместе с сыном посадила ель. Когда шесть лет назад он умер, дерево осталось как память о нем. Три года назад у Анны Фольц умер муж — уважаемый в районе шахматный тренер Рудольф Фольц. Декабрьским утром она обнаружила, что дерева в палисаднике больше нет. Выяснилось, что местные власти спилили его и установили на площади к Новому году. Через несколько дней после происшествия с елью у Анны Фольц умер второй сын, и теперь она говорит, что бороться с чиновниками у нее просто нет сил. А ель стоит на поселковой площади. 
None	«Собор был построен нашими предками не для того, чтобы там болтался маятник Фуко или чтобы там петербургская интеллигенция водила экскурсии с шампанским на балкон. Это место, где русская нация должна осуществлять свою исконную религию, которая ей присуща». Собрали цитаты сторонников передачи Исаакия РПЦ в один мощный абзац:
None	Зажигать огонь теперь планируется лишь в дни воинской славы — в общей сложности 17 дней в году.
