None	Пользователи Telegram довольно часто пишут нам на @meduzalovesyou с вопросами — где читать те или иные материалы «Медузы» в телеграме. На самом деле, все довольно просто:Наш главный (редакционный) канал Meduza LIVE:  попадают все главные тексты и новости дня с теплыми ламповыми анонсами, которые пишут сотрудники редакции (даже Колпаков иногда пишет!).Канал, куда (автоматически) падают вообще все новости:  куда приходит «Вечерняя Медуза»:  теперь мы присылаем «Вечерку» в телеграм с красивым форматированием!Еще у нас есть бот — @meduzaprobot. Он умный, напишите ему, и он сам вам расскажет, что умеет.Ну и возвращаясь к началу этого поста — @meduzalovesyou — это аккаунт, на который вы можете отправлять свои вопросы, пожелания, предложения, лучи ненависти и любви. Стараемся читать его постоянно и отвечать оперативно.Ваша дорогая редакция
None	Кто вчера пропустил наш вечерний утиный тест, нагоняйте
None	10 главных русских видео года. Есть талантливые, но и пара порталов в ад прилагается
None	Монтажники, но не высотники
None	Моя голова слишком часто занята моими творческими амбициями и попытками разобраться с самыми разными житейскими делами. «Кто из музыкантов лучше сыграет эти песни?» «Записываю ли я их в правильной студии?» «Правильно ли выбрана тональность для песни?» Некоторые вещи не меняются даже за четыреста лет.И никогда в жизни у меня не было времени спросить себя: «А мои песни — это литература?»Письмо Боба Дилана Нобелевскому комитету:
None	Если слова «Грибы» и «Луна» пока не вызывают у вас в голове музыкальных ассоциаций, прочитайте этот текст Александра Горбачева. Потому что «Грибы» и «Луна» — два ярчайших дебюта 2016 года в России. Чего стоит хотя бы тот факт, что дебютный альбом «Грибов» стал самой популярной музыкальной записью за всю историю «ВКонтакте». 
None	Отделение «Би-би-си» в Таиланде опубликовало текст о новом короле Махе Вачиралонгкорне, единственном сыне скончавшегося Пхумипона Адульядета. Вачиралонгкорн известен эксцентричным поведением: он давал любимому пуделю Фуфу звание маршала военно-воздушных сил, появлялся на публике в крайне странном виде, не раз женился и разводился и вел образ жизни плейбоя, а не будущего короля. За репост заметки «Би-би-си» задержали активиста. 25-летний мужчина был арестован в самом начале декабря — через несколько дней после того, как Вачиралонгкорн официально согласился взойти на престол. 
None	Трое под елкой. И все они собаки
None	«Признаки состава преступления по статье 105 налицо: когда полиция вошла в дом, были обнаружены тела двух несовершеннолетних, поэтому до установления всех обстоятельств преступления дело будет расследоваться по этой статье»
None	Сегодня новая серия Шерлока. Самое время вспомнить, что мы о ней уже знаем
None	Судя по всему, в ближайшие лет десять роботы полностью вытеснят людей из ряда профессий. Вопрос для работодателя: не пришло ли время оптимизировать процесс? Вопрос для работника: не пришло ли время обучиться чему-нибудь новому? материал
None	— Скажите, а когда вы получили нематериальный ущерб в три миллиарда рублей? — спросил под конец прений адвокат Резник.— 11 апреля. Сразу, как вышел материал, — ответил представитель «Роснефти».— А в экспертном заключении, представленном истцом, говорится об ущербе, который только может наступить в будущем, — обратился Резник к суду.Товкаев и Мельников поддержали коллегу, заявив, что ни одного доказательства, что статья причинила «Роснефти» ущерб так и не было представлено.
None	Эти ваши медиа — не место для освещения всяких там процессов!
None	Тем, кто еще не проверил себя на знание дальнего и ближнего космоса, всячески рекомендуем этот научно-фантастический тест
None	По мнению военных, в трубы могут быть вмонтированы прослушивающие устройства. А сама глубокая гавань Слите может быть использована для высадки российского морского десанта в случае конфликта.
None	В Калифорнийском университете в Беркли вчера активисты в масках устроили погром перед лекцией редактора Breitbart News Майло Яннопулоса, мероприятие пришлось отменить. Трамп обвинил университет в нарушении свободы слова
None	«То, что этот день совпадает с замечательным праздником, который мы отмечаем уже несколько лет, — это очень хорошо»
None	В альянсе считают, что ПРО может стать одним из предметов сделки между Трампом и Путиным
None	Первый онлайн года! Болеем за наших. 
None	Похоже, слова скоро можно будет отменить совсем
None	Главный текст недели — про чеченцев, которым приходится бежать из Чечни из-за Кадырова
None	Поинтересовались у так называемых системных политиков, что они думают о расследовании Навального про Медведева. Вот, например, что ответила замруководителя фракции ЕР в Госдуме Раиса Кармазина:— Мало ли что там пишет Навальный, он кто такой? Прокурор, [сотрудник] СК РФ? Он просто гражданин. Это его личное дело, понятное; человек, который лезет в политику, который ничего не сделал для страны, вообще ничего, ноль! И я его комментировать не собираюсь. Пусть сначала бревно в глазу вытащит. &lt;...&gt;Я не собираюсь никуда [обращаться с просьбой проверить информацию], потому что у меня забот полон рот. Да и кто он такой? На каждый чих обращаться? Предвыборный год, что — не понятно, что ли?
None	Вы наверное заметили, что на «Медузе» стало много обстоятельных текстов про медицину. Объясняем, почему мы решили взяться за эту тему всерьез и даже привлекли специального редактора — Дарью Саркисян (это она создала паблик «Намочи манту»). Если вкратце, то нам очень не нравится как по-русски пишут и разговаривают про медицину, не нравится огромное количество мифов и традиций, которыми руководствуются люди. И даже лечащие врачи зачастую имеют о современной медицине весьма отдаленное представление.
None	Волнуется человек, но вообще инициатива похвальная. Особенно в части, где фристайл начинается
None	В декабре 2016 года исполнилось 25 лет распаду СССР. Сейчас Советский Союз принято идеализировать: не только пожилые, но и молодые люди с ностальгией говорят о замечательном государстве, к которому все относились со страхом и уважением, где были лучшие в мире медицина и образование, где все жили в достатке и каждый был уверен в завтрашнем дне. К сожалению, все было не совсем так, и именно об этом наш текст-разбор.
None	Фильмы, пластинки, книжки, игры. В 2016-м вышло много всего хорошего — мы выбрали то, что уж совсем не стоило пропускать. Ну а вы можете добавлять свои варианты к этому списку
None	Где искать достоверную информацию про новые лекарства:  главное, не на сайте Минздрава!)
None	Спортсмен будет обжаловать решение CAS
None	«Следующее, что я хотел бы сказать, стоя... На скамье подсудимых, так? Странное место, чтобы выступать с политическими заявлениями, но в современной России для честного человека... [Обращаясь к судье] Вы хотите что-то мне сказать? Это и есть суть процесса, ваша честь, вы отлично знаете, что это и есть суть процесса. А суть в том, что для многих честных людей — и для меня тоже — скамья подсудимых становится главной площадкой для выступлений».
None	Сирийская армия снова вошла в Пальмиру. Без поддержки ВКС России не обошлось!
None	Пожалуй, лучший способ провести этот четверг
None	«Роснефти» приходилось искать инвесторов не на открытом рынке — но почему сделка была обставлена как спецоперация? Означает ли неожиданное объявление покупателей, что они появились в самый последний момент? Были ли другие претенденты? Не принес бы открытый аукцион больше денег правительству? На все эти вопросы нет четких ответов, а без этого нельзя со стопроцентной уверенностью говорить, что сделка была справедлива.
None	Все, что вы хотели знать о Snapchat post,969485,— Самый интересный был момент, когда вот этот фсбшник листал бумаги, и там были документы обыска моей мамы и папы тридцатилетней давности. И он смотрит и говорит: «Ой, как интересно, тут сотрудники, которых я знаю». А я ему говорю: «Слушайте, а я думала они уже все умерли, я их искала, я хотела бы с ними пообщаться. Он говорит: «Нет, нет, они не умерли». То есть представляете: прошло тридцать лет, и вдруг эти люди приходят ко мне.
None	!!!
None	Ситуация примерно как с гречкой в 2014 году
None	Очень плохая музыка
None	Сделали подробный профайл о персонаже, известном как Филипп Лис. Кто он такой, откуда взялся, какое отношение имеет к так называемым «группам смерти» в социальных сетях
None	«В России хорошо, но прекрасно жить только богатым. Это абсурд, что миллионы людей нашей богатейшей страны вынуждены „выживать“. Европа больше приспособлена для жизни простых людей». 
None	Поисковик убеждал пользователей, что бывший президент США Барак Обама собирается ввести военное положение и готовит государственный переворот. А также называл политика «королем Соединенных Штатов», сначала ссылаясь на соответствующую статью, а затем — на заметку о том, что гугл называет Обаму «королем США».
None	Просто пришла и вскрыла банковскую ячейку
None	Доктор Сюсс в 1941 году нарисовал серию карикатур, осуждающих решение президента Рузвельта ограничить прием евреев, бегущих из нацистской Германии.На картинке женщина читает испуганным детям сказку «Волк Адольф»: «Волк сжевал детей и выплюнул их кости. Но это были иностранные дети, так что это совершенно не имеет значения». На кофте у женщины слоган: «America First».
None	Официально ранение генерала пока не подтвердили. Но раньше Минобороны уже сообщило о гибели четверых военных советников. Так вот, они ехали в одной машине с генералом
None	Абсолютно киношная история из Франции. Инкассаторы из компании Loomis ехали на микроавтобусе по трассе недалеко от Лиона, когда им преградил путь легковой автомобиль, а другой остановился рядом. Из машин вышли четверо преступников, вооруженных винтовками, и забрали у инкассаторов 70 килограммов золота.
None	Лаконично.
None	Наталья Поклонская сообщает: в Крыму у здания прокуратуры замироточил бюст Николая II.
None	Печально, в общем
None	«Престиж России на международной арене будет восстановлен, рубль укрепится, Владимир Путин почувствует свою миссию выполненной и начнет рассуждать об уходе на покой». Блумберг, не останавливайся, пожалуйста. Продолжай
None	Традиционная новогодняя забава
None	«Верю — не верю» — идеальная игра для путешествия. А рабочий день может и вовсе уничтожить. Мы предупредили! материал
None	Джон Оливер пообщался с Далай-ламой и выяснил много интересного
None	Рисковый парень
None	Гигантский разлом 😲
None	По словам севастопольского омбудсмена, освобожденные моряки —семеро россиян и украинец — находятся во Франкфурте, все они «живы и здоровы». Об обстоятельствах освобождения заложников Буцай не сообщил
None	!! В указе сказано, что он принят, «руководствуясь принципами гуманности».
None	Тест про разные штуки, которые можно собрать из «Лего». Тут нашлось место и слову «базинга», и «Звезде смерти», и Бобу Дилану с битлами. материал
None	Слово «нейросеть» стало одним из главных слов 2016 года. Все больше сервисов используют алгоритмы машинного обучения, причем как для серьезных целей, так и просто для развлечения
None	Главу нефтяной компании Exxon Mobil Рекса Тиллерсона сейчас называют одним из главных претендентов на должность госсекретаря в администрации Дональда Трампа. Бизнесмен на протяжении многих лет вел дела с «Роснефтью» и знаком с Путиным; у него даже есть почетный российский орден.
None	Если надоело читать новости, можете развлечь себя тестом на знание европейских столиц. Тем, кто много путешествует, будет проще. А тем, кто на новогодние праздники собирается в Европу, будут весьма кстати ссылки на наши «Атласы» — некоторые города-фигуранты в них подробно описаны. 
None	Сегодня в Московском окружном военном суде прошли прения по делу Варвары Карауловой, которую обвиняют в попытке примкнуть к ИГ. Сама она утверждает, что ехала в Сирию для встречи с возлюбленным. Прокурор:— Я могу предположить, что между молодыми людьми по интернету могла возникнуть симпатия, но очевидно, что назвать это любовью никак нельзя.Ведь они ни разу лично или хотя бы по телефону или скайпу не общались! А в вотсапе нельзя оставлять голосовые сообщения длиннее 30 секунд, это все знают! Такого времени явно не хватит, чтобы прочувствовать голос собеседника
None	Глава Uber Трэвис Каланик покинул совет при Дональде Трампе после того, как компания столкнулась с бойкотом - американцы решили, что она поддерживает нового президента США
None	«Если ты хочешь поехать за границу, то получаешь характеристику из партийных и административных органов и представляешь обоснование, зачем ты едешь — в командировку, в творческую поездку, отдохнуть или подлечиться. После этого ты получаешь разрешение на выезд из страны».
None	Собрали свежую подборку мемасов со Ждуном, наслаждайтесь: в нашем телеграм-канале можно разжиться еще и тематическим стикерпаком:
None	Make America I’ll Be Back Again
None	Джошуа Аарон, подозреваемый по делу о краже данных 100 миллионов клиентов JPMorgan, был задержан в мае в Москве за нарушение визового режима. С тех пор его держали в центре для нелегальных мигрантов в Подмосковье
None	Полицейские просят прощения у музыкантов. Трогательно
None	Говорит, «всегда знал, что Путин очень умен»
None	Современный компьютер можно обучить почти всему. Он может стать врачом, финансовым аналитиком или обрабатывать обращения клиентов. Задумайтесь, а какие процессы хотелось бы автоматизировать вам? материал
None	— Как вы узнали о «Кировлесе»? — спросил прокурор.— С помощью чудо-поисковых машин «Яндекс» и Google, — отвечал Офицеров.Допрос продлился около часа. Офицеров, как и накануне Навальный, разочарованно воскликнул: «А где же вопрос: куда дели деньги? Ваша честь, неужели у вас тоже нет вопросов?»Но вопросов у суда не было. Защита представила еще несколько ходатайств, судья ушел думать, Навальный пытался его остановить: «Ваша честь, не уходите! Мы хронометрировали: вчера в совещательной комнате вы провели больше времени, чем в суде. Вы же все равно нам откажете». Судья оставил призыв без внимания, а выйдя из совещательной комнаты, в ходатайствах отказал.
None	2016 год подарил нам много разных героев — как положительных, так и отрицательных. Про некоторых из них вы уже могли успеть забыть, а между тем всегда интересно посмотреть, где оказался тот или иной персонаж к концу года, чем закончилась или может быть продолжилась его история.
