None	Умер астронавт Джон Гленн. В 1962 году он первым из американцев облетел вокруг Земли. В 1998-м он стал самым пожилым человеком, побывавшим в космосе, совершив полет на шаттле «Дискавери» в возрасте 77 лет
None	Поучительная история про демократию в Африке:
None	Альпака, Мачу-Пикчу и жареный куй. Много ли вы знаете о Перу? материал
None	Составили для вас (и для себя) новогодний четырехчасовой плейлист.В начале джаз и умная электроника для неспешных разговоров и салатов, затем фанк и хип-хоп для танцев и наконец нормальные песни — для пения. Дальше вы сами!
None	Ханнес Грассеггер, отвечая на вопросы «Медузы», признал, что микротаргетинг используется в предвыборных кампаниях уже много лет, а оценить его эффективность в условиях тайного голосования затруднительно. Журналист также подчеркнул, что победу Дональда Трампа обеспечило множество факторов, и метод Cambridge Analytica не является единственным или ключевым. Между тем, из текста следует как раз обратное.
None	Ничего нового. 
None	Очередная версия Popcorn Time ничего общего с онлайн-кинотеатром, за исключением названия, не имеет. Как любая программа-вымогатель, после установки она шифрует содержимое диска и требует выкуп за разблокировку. Есть и другой вариант — нужно послать ссылку на псевдо-Popcorn Time двум друзьям, и если они установят программу и заплатят выкуп, тогда и ваш компьютер разблокируют. Создатели схемы утверждают, что они — группа студентов из Сирии, которые таким образом хотят заработать на еду, медикаменты и другие необходимые для нормальной жизни вещи. Никакого подтверждения, что это правда, не существует.
None	В разделе «Мемы» две верхние строчки заняли «Лабутены» и «В Питере — пить», связанные с клипами группы «Ленинград». В топ-10 мемов года также дважды попал премьер-министр Дмитрий Медведев. На третьей строчке расположились его слова «Денег нет, но вы держитесь», а на девятой — слово «русиано», которым он предлагал называть кофе американо.
None	Матрешки, за которые не стыдно! (а внутри промокод на скидку) материал
None	«Фонтанка» пишет, что военная контрразведка ФСБ занялась «Шалтаем-Болтаем» в 2015 году по приказу министра обороны Сергея Шойгу. Поводом для этого якобы стали выставленный на продажу массив документов, связанный с ведомством, и открытое письмо к главе военной контрразведки, в котором говорилось о «полной некомпетентности в вопросах информационной безопасности» сотрудников Минобороны.Центр информационной безопасности ФСБ, сотрудники которого были арестованы по делу о госизмене и упоминались в СМИ как кураторы «Шалтая-Болтая», якобы занимался разработкой группы параллельно.
None	Жизненный тест. Никогда не знаешь, когда твою почту/вк/айклауд попробуют взломать. Например, если вдруг твой айфон попадает в чьи-то недобрые руки
None	Так-так
None	Начинаем утреннюю гимнастику
None	Следствие считает, что его заказал замглавы регионального управления ФСИН. Погибший курировал строительство новых «Крестов», которое продолжается уже десятый год
None	Теперь решение за Конституционным судом
None	Подойдет! Причем поехать туда вполне реально: материал
None	Возможно, лучший способ скоротать время между постновогодними вечеринками
None	«Они кричали: НТВ лжет! Но что они скажут теперь, когда заговорит он?» — сказано в анонсе программы
None	Владимир Жириновский прокомментировал освобождение Евгении Чудновец, которую посадили в тюрьму за репост.
None	Россиянин Евгений Донской (116-я ракетка мира) одержал в Дубае самую что ни на есть волевую победу над Роджером Федерером (десятой, на данный момент, ракеткой мира)
None	Алексей Навальный объявил о намерении баллотироваться в президенты. А вот как он начинал свой путь в политике девять лет назад:
None	Уникальный шанс задать вопрос Михаилу Леонтьеву! (Можно спрашивать даже о самом сокровенном)
None	Есть два сайта: Conservative 101 — для консерваторов, Liberal Society — для либералов. На одном пишут, что Обама плохой, а Трамп хороший; на другом — наоборот. При ближайшем рассмотрении выясняется, что пишут в одних и тех же выражениях. То есть буквально: одно и то же предложение, только в одном — эпитет «отличный», а в другом — «ужасный».А при еще более ближайшем рассмотрении выясняется, что сайты принадлежат одной компании — и у нее есть еще несколько изданий такого же плана, материалы которых распространяются через группы для возмущенных американцев на фейсбуке. Как говорится в таких случаях, PROFIT!
None	Чтение на выходные от Галины Юзефович post,928300,Жутковатая фотогалерея из Авдеевки и Донецка, где снова стреляют с обеих сторон. 
None	Имперские штурмовики круто выглядят, но плохо стреляют. Такова их роль в мировой культуре
None	Тяжелых травм, к счастью, у пассажиров нет 
None	Самое удивительное событие уходящей недели — перепутанные конверты на Оскаре!
None	Согласно указу, исключения могут быть сделаны для тех, кто уже находится в дороге и из-за отказа столкнется с «чрезмерными трудностями», а также для представителей религиозных меньшинств
None	Взял, что называется, под личный контроль
None	Можно играть в Алису в Зазеркалье
None	Помните, зависть понижает качество вашей жизни.
None	Что мы слушали в феврале — Maggie Rogers, «Обе две», Stormzy, Thundercat, Vagabon и многое другое
None	Похоже, российские хакеры скоро станут мемом
None	В Смоленской области житель села Ольша поджог свой дом и дом соседа. Тот вышел на улицу, и мужчина застрелил его из автомата Калашникова, а затем и еще одного прохожего. Когда в село приехали пожарные, он открыл по ним огонь и ранил троих. При задержании он выстрелил в себя и умер в больнице.
None	Родился в Махачкале. В 1990-е оказался в Петербурге. Работал журналистом. Писать не умел, но добывал информацию — выпивал с источниками, крутил романы с секретаршами. В начале 2000-х начал искать и продавать компромат на местных чиновников и бизнесменов. Засветился на тусовках «Фонда эффективной политики» Глеба Павловского и стал вхож в администрацию президента...
None	В докладе Макларена сказано, что в пробах сразу двух золотых медалистов Сочи-2014 обнаружили такое количество соли, которое не может присутствовать в моче здорового человека. Имена спортсменов не называются, но в докладе отмечается, что эти двое атлетов завоевали четыре олимпийских золота. Пробы с превышением соли были обнаружены в четырех видах спорта: лыжных гонках, хоккее, босбслее и биатлоне. Однако Россия не заняла призовых мест в хоккее, а в лыжных гонках и биатлоне российские спортсмены завоевали только по одному золоту. 
None	«Еще несколько дней назад Светлана говорила, что прошение не направляла. Возможно, в эти дни — пока мы не виделись, — ей подсунули бумажку, или надавили на нее, — рассказал „Медузе“ адвокат Севастиди. — Или сам президент решил помиловать ее. У нас такая страна, где президент может что угодно».
None	Австралия — удивительная страна. Оттуда редко приходят какие-то серьезные новости, но зато там регулярно творятся какие-то безумства 
None	Идеальное новогоднее ТВ. Никаких огоньков, только коалы, ленивцы и другие замечательные животные!
None	Правительство Румынии хочет помиловать чиновников-коррупционеров. В связи с этим в Бухаресте прошел скромный митинг протеста (не более тысячи человек, по оценкам ГУВД Москвы)
None	Запутанная история отношений Джимми Киммела и Мэтта Дэймона
None	Пресс-секретарь ФБК Кира Ярмыш сообщила «Медузе», что приставы сначала отвезут Навального домой, чтобы он собрал вещи, потом доставят в управление, а затем сопроводят в аэропорт. Ярмыш отметила, что Навальный не задержан.
None	ФРС второй год подряд повышает ставку
None	Вы не поверите, но тут некоторые заявляют, что айсберг не виноват
None	Сегодня в Ленинском районном суде Кирова допрашивали Навального и Офицерова....Судья объявил очередной перерыв, после возобновления заседания Навальный вышел к трибуне и предложил Втюрину сделать совместное селфи. Тот с серьезным видом отказался. Навальный сфотографировал себя на фоне зала заседаний и зрителей.— Обсуждали ли вы маркетинговую политику ВЛК? Например, ее логотип? — спрашивали прокуроры; вопросы у них не заканчивались.— Может, вы что-то у меня спросите? Например, куда делись деньги-то? — почти взмолился Навальный, обращаясь к судье, но Втюрин предложил подсудимому занять свое место.
None	Еще до того, как Дональда Трампа назвали человеком года, читатели Time придумали несколько альтернатив. Кандидаты неплохие, например, Смерть
None	Пришел черед «Почты России»
None	«Меня интересует шизофрения российских государственных органов. И это просто пример, который я буду использовать, в частности, в своей докторской диссертации. Наше законодательство требует, чтобы я имел свой личный интерес, а иначе будет спрашивать, чего это я к нему пришел. Фактически мне как врачу приходится прививать себе оспу или холеру».Илья Азар рассказывает историю одного довольного странного иска:
None	Как рассказал один из ученых, он очень любил книги о Гарри Поттере, когда был подростком. «Когда мы обнаружили этого крошечного паука, я подумал о Распределяющей шляпе», — поделился Джавед Ахмед.
None	«Недовольство населения экономикой, страной и лично Обамой — это миф. У него сейчас самый высокий рейтинг с 2009 года, около 60%! При условии что у нас свободная пресса, разрешена критика власти и оппозиционно настроенный конгресс — это очень много. А Клинтон просто не смогла заинтересовать людей, сделать так, чтобы они захотели видеть ее президентом. Ну и кроме того, были два внешних потрясения, которые Клинтон никак не могла контролировать и которые очень сильно сказались на итогах выборов: это WikiLeaks, которые на всем протяжении кампании по капле продолжали публиковать украденные данные, и глава ФБР Джеймс Коуми, сообщивший прессе о расследовании в отношении Клинтон».
None	Двое студентов решили устроиться в Amazon. И вот с чем им пришлось столкнуться. Шиван Каул созвонился с сотрудником сервиса ProctorU, который должен следить, чтобы во время экзамена соискатель не пользовался подсказками. Каул по указанию этого сотрудника установил программу, при помощи которой тот получил полный доступ к его компьютеру. Человек на том конце стал двигать мышкой и закрывать приложения, а потом изменил настройки так, чтобы нельзя было сделать скриншот.После этого собеседник попросил Шивана Каулу поднять ноутбук и показать стол через камеру. «Уберите все со стола», — услышал соискатель в этот момент. По словам студента, сначала он даже не понял, правильно ли расслышал, но собеседник уточнил: «Ваша организация потребовала, чтобы у вас не было никаких письменных материалов».Шиван Каул отказался убираться на столе, поскольку на это бы ушел час, —поэтому он предложил пройти экзамен на кровати. Собеседник согласился, но потребовал показать кровать и убрать с нее простыни, чтобы убедиться, что там нет подсказок. Кроме того, сотрудник ProctorU несколько раз потребовал показать всю комнату: «Покажите пол, пожалуйста. Нет, сэр, встаньте со стула, отодвиньте его и покажите снова».
None	«Я выигрывал, у Мораиса уже один глаз был закрыт — и, чтобы закрыть второй, мне нужно было нанести еще несколько ударов, — спокойно рассказывает Илюхин. — Я был на нем сверху, он ткнул мне в глаз, я пытался проморгаться, просто нестерпимо хотелось рукой глаз протереть. Я встал, стал вытирать мокрую руку о шорты — и вдруг он меня зацепил. Я падаю, он сверху — и начинает бить по затылку. Я эти удары в какой-то момент и чувствовать уже перестал. Тут он давай еще и губу рвать, я начал судье сигнализировать, он остановил бой и отдал бразильцу победу. Я день отлежался — вроде нормально все. Потом уже в больницу пошел — обнаружилось, что зрение подсело».
None	У (талантливой) группы «Обе две» вышел новый (талантливый) мини-альбом под названием «Мальчик». Можете послушать его прямо сейчас на «Медузе», если вы еще не!
None	Новости вакханалии вокруг мироточивого бюста Никлая II. Поклонская рассказывает в эфире о чуде, смотритель часовни подтверждает, "Лайф" устраивает стрим, чтобы посмотреть, мироточит или нет, и только РПЦ спокойно заявляет, что пожалуй не будет это комментировать
None	Но с оговорками! Самой ФСБ американские компании ничего поставлять не могут. И в Крым тоже.
None	Несовременно как-то. Почему не Кендрикламарская или Каньевэстовставская, например
None	«Это наша вина», — заявил Путин
None	Матрешки, за которые не стыдно! (а внутри промокод на скидку) материалpost,855285,В Стамбуле в результате двух взрывов у стадиона в районе Бешикташ погибли 29 человек, 166 получили ранения
None	Но кое-что внутри они все-таки нашли
None	Трамп в твиттере обвинил Обаму в "новом Уотергейте". За пределами твиттера никто не понимает, что произошло
None	Ох. Журналист Владимир Кара-Мурза находится в реанимации, в критическом состоянии. «В настоящее время Володя не в сознании. Наступила полиорганная недостаточность. Проводится искусственная вентиляция легких, гемодиализ и иные реанимационные процедуры», — говорит его адвокат Вадим Прохоров.
None	Держитесь здесь
None	Очки, дополняющие реальность (если у вас есть айфон)
None	Как только в американских СМИ речь заходит о России или Владимире Путине, с газетами и телеканалами происходит что-то странное. То назовут Путина убийцей, то заявят, что российские хакеры вывели из строя электростанцию в Вермонте, то еще что-нибудь в таком духе. Источники странные, выводы зачастую тоже. Рассказываем, что не так с американскими статьями о России
None	Это важно!
None	Самая полезная инструкция для новогодних каникул — как готовить горячие алкогольные напитки: глинтвейны, тодди, эгг-ног и другие рецепты, которые здорово скрасят вам зимние праздники
None	В Пальмире возобновились бои — спустя несколько часов после сообщения о том, что атака ИГ отбита
None	В Набережных Челнах живет иллюстратор по имени Ландыш, которая рисует офигенные англоязычные открытки про жизнь с кошкой и собакой. Там про все: и про то, как мы их любим, и как они избалованны. И вечный сюжет про котов, которые будят нас среди ночи просто так. 
None	В ряду наших «Атласов» долгожданное пополнение! Путеводитель по Санкт-Петербургу, который мы сделали вместе с re:Store. Где завтракать, по каким маршрутам гулять, в каких местах выпивать и чего лучше не делать, если отправляетесь в город на Неве.  
None	Вот вроде бы все, как в старые добрые времена. Та же песня, те же утки. Но что-то все-таки тут не то!
