None	«Кажется, что Ханья Янагихара просто садистка и ей важно любой ценой добиться от читателя слез. Однако мучаться на протяжении семисот страниц невозможно, и в какой-то момент эмоции просто отключаются: читателю становится все равно, страдания героев перестают его трогать — и остается только неловкость из-за собственной сентиментальности».или«Методом точно просчитанных ударов Ханья Янагихара дестабилизирует читателя, после чего у него в мозгу запускается уникальная, ни на что не похожая, персонализированная цепочка мыслей, образов и ассоциаций. Именно поэтому „Маленькая жизнь“ вызывает такой сильный эмоциональный отклик».
None	Было много споров по поводу этого материала. Так вот, мы остаемся при своем мнении
None	Прочитали политическую программу Навального. Обнаружили там много странного: фактические ошибки, отсутствие расчетов и вообще каких бы то ни было подробностей. 
None	Связь с машинистом — только через Александра Невского
None	Жители Лос-Анджелеса проснулись в другом мире
None	В заметке, посвященной связям окружения Трампа с РФ
None	Президент мгновенно отреагировал на распоряжение генпрокурора, которая приказала подчиненным не защищать положения указа в судах иммиграционной полиции тоже сменили
None	Продолжаем искать советское в российском! Тест
None	Съездили в отпуск, хорошо, что живы остались
None	9 декабря Никита Михалков заявил, что деятельность «Ельцин-центра» «разрушает национальное самосознание детей», так как дает необъективную оценку истории России. «Это вопрос национальной безопасности, поскольку сотни детей получают этот яд каждый день», — сказал Михалков. Наина Ельцина сегодня напомнила ему, что в 1996 году он поддерживал Бориса Ельцина и даже был его доверенным лицом. 
None	Продолжаем отмечать годовщину распада СССР. На очереди тест про безумные аббревиатуры:
None	Кстати насчет Эммы Уотсон
None	В ГИТИСе не первый месяц продолжается конфликт, связанный с инициативами нового ректора Григория Заславского — в декабре студенты взбунтовались против задуманного им объединения театроведческого факультета с продюсерским. На прошлой неделе на «Медузе» вышло интервью с Заславским, в котором он заявил о кризисе на театроведческом факультете. Сегодня мы публикуем интервью с деканом факультета Натальей Пивоваровой — она с ректором не соглашается.
None	Если бы не патриарх Кирилл и лайки, это было бы главное видео среды
None	«Я думаю, это смешно. Я думаю, это очередная попытка [демократов] оправдаться. Я в это не верю»
None	Задержан глава центра «Э» Ингушетии, за что — пока неизвестно. Летом в помещении центра после избиения сотрудниками умер подозреваемый.
None	Неизвестные напали на начальника полиции города Отрадного и его жену ночью у них дома. Женщина погибла, мужчина находится в реанимации
None	Мы не можем верить ни украинским властям, ни представителям пророссийских сепаратистов, поскольку это стороны конфликта. В зоне боевых действий почти нет журналистов — те, кто есть, освещают столкновения только с российской стороны или только с украинской стороны. 
None	Сперва были задержаны 13 человек. Потом на Горбатый мост пришли еще два человека, их тоже задержали
None	При этом больше половины избирателей поддерживают указ Трампа о беженцах. Америка — страна контрастов!
None	Продолжаем рассказывать самые интересные истории 2016 года. Например, выяснилось, что Отто Скорцени, командующий крупнейшими спецоперациями Рейха, которого в годы Второй мировой называли самым опасным человеком в Европе, после войны работал на «Моссад».
None	Все, что вы хотели знать о Snapchat post,928300,Жутковатая фотогалерея из Авдеевки и Донецка, где снова стреляют с обеих сторон. 
None	Фийона подозревают в том, что, будучи депутатом Национальной ассамблеи, он назначил помощницей свою жену Пенелоп, которая получала зарплату, не выполняя практически никакой работы. На посту сенатора он якобы платил в аналогичной ситуации своим детям
None	Кек
None	Около 200 сторонников осужденного военнослужащего устроили столкновения с полицией у здания суда 
None	Из интересных историй ушедшего года — фрагмент биографии Владимира Путина, написанной американцем Стивеном Ли Майерсом«Было ясно, что в случае утраты документов под трибунал пойдет и сам Путин, однако указаний из центра не поступало. Он думал о своей работе, о своей семье, чье благосостояние от этой работы зависело. Он чувствовал, что Советский Союз вот-вот рухнет, а с ним и вся понятная ему жизнь — жизнь кадрового разведчика. Той ночью подполковник Путин, обуреваемый самыми мрачными мыслями, совершил самый решительный и самый рискованный поступок за все время своей службы в КГБ».
None	Как сообщила мама одного из учеников школы № 2065 Инна Герасимова, в учебном пособии к этому курсу, «постоянно говорится про нечистую силу, святую воду, ангелов-хранителей, совершенно серьезно рассказывается про чудеса, которые творят иконы». Изучение курса «Истоки», как подчеркнула она, является в их школе обязательным.
None	Сотрудники Life78 приехали вместе с Солтан к ней в квартиру. Они сняли сюжет, в котором Анастасия показывала им жилье, говорила, что хочет опять лечь в больницу, о том, как она обижена на родителей за то, что «не научили жить без них». Журналисты уехали, оставив Солтан одну. Следующим вечером она покончила с собой. После ее гибели Life78 сделал еще несколько материалов о ней и ее семье.
None	В 2015 году китайский ученый Лида Син отправился на рынок в Мьянме, где продают янтарь для изготовления ювелирных украшений. Там он обнаружил кусок янтаря, в котором остались перья динозавра. Раньше ученые уже находили отдельные перья динозавров, но здесь сохранилась целая часть хвоста длиной в три сантиметра. Возраст находки оценивается в 99 миллионов лет. 
None	Мы всегда знали, что Овечкин крутой. Забором его не напугаешь
None	У Google есть очень хорошая капча ReCAPTCHA. И очень популярная. Казалось, роботам ее не обойти. Но выяснилось, что взломать ReCAPTCHA с легкостью может другой сервис Google.
None	Рената Литвинова посоветовала инвалиду, участвующему в «Минуте славы», пристегнуть отсутствующую ногу, «чтобы не эксплуатировать эту тему»
None	От прощального альбома Боуи и новой версии DOOM до «Молодого папы» и «Ла-Ла Ленда». Сериалы, кино, музыка, книги и игры, которые в этом году не стоило пропускать. Так что если вдруг пропустили — наверстывайте на каникулах!
None	В результате обстрелов была обесточена Донецкая фильтровальная станция, которая снабжает водой как Авдеевку, в которой действует украинская администрация, так и Донецк и Макеевку, которые контролируются сепаратистами. Во втором случае подачу воду удалось восстановить за счет других источников
None	С - Смекалочка
None	Однокурсник Медведева говорит, что это все благотворительность. Ну там, яхты, поместья, виноградники, кроссовки, плавки...
None	Важнейший российский негосударственный вуз спасли от закрытия
None	Трамп осовременил вечное «утром в газете – вечером в куплете». Только вместо газеты один не самый объективный сайт, а куплетистом стал президент США
None	Россиянин зарегистрировал домен, который вроде бы google.com, но не совсем, и рассылал с его помощью спам с восхвалением Трампа. Google хочет вернуть домен себе. 
None	А также перехватили, как российские чиновники поздравляют друг друга с победой Трампа
None	В 8-страничном обращении сотрудники попросили дать оценку действиям и. о. руководителя СК по Новгородской области Екатерины Гилиной, занявшей эту должность в 2014 году. В обращении говорится, что «по ее [Гилиной] указанию незаконно, без всяких на то оснований, возбуждаются уголовные дела как в отношении должностных лиц, так и иных граждан». Производство по другим делам, как следует из обращения, Гилина, напротив, намеренно тормозила или вовсе прекращала. 
None	Проголосовать на выборах, переехать в другой город, устроить детей в детский сад, получить кредит. Что еще непросто сделать россиянам из-за необходимости иметь регистрацию.
None	Сделали плейлист с самыми классными, как нам кажется, песнями года. Песен набралось 26 — от Канье, A Tribe Called Quest и The Weeknd до «Петли пристрастия» и ГШ
None	Власти решили, что необходимо создать специальный реестр компьютерных систем и телекоммуникационных сетей, которые сейчас используются в самых разных сферах — от оборонной промышленности до здравоохранения. Каждому объекту в зависимости от социальной, политической, экономической, экологической и военной значимости присвоят определенную категорию — высокую, среднюю или низкую. Все эти объекты вместе взятые как раз и представляют собой «критическую информационную инфраструктуру РФ». Хакера, получившего «неправомерный доступ к охраняемой информации», в худшем случае осудят на 10 лет. В лучшем — он отделается штрафом в миллион рублей или лишится зарплаты за три года.
None	А что у вас на ужин?
None	Давно известно, что объединяться против чего-то, гораздо прикольнее, чем объединяться за
None	«Юридическая аргументация — самое слабое место нового расследования Фонда борьбы с коррупцией. Я не вижу чего-то противозаконного в том, что сделал господин Медведев. Дело в том, что из-за лакун в российском законодательстве выходит так, что все перечисленные в расследовании активы оформлены в соответствии с законом. В европейской стране вся эта ситуация стала бы поводом для отставки премьера и кабинета, но в России это маловероятно».
None	Тест про русский рэп. Мы вам говорим строчку из реальной песни и предлагаем четыре варианта следующей — вам надо угадать правильный. Аккуратно, неправильные варианты довольно правдоподобные!
None	Дональд Трамп обвинил Барака Обаму в прослушивании своего телефона. Но, кажется, он просто начитался fake news
None	Скандал вокруг проверки «Ревизорро» в ресторане «Одесса-маме» принял новый оборот. Телеканал «Пятница!» подал в суд на пользователей фейсбука, критиковавших работу «Ревизорро». «Хочу, чтобы люди поняли, что нельзя безнаказанно публично писать, что мы берем взятки, угрожать Летучей, обещать отрезать ей голову и выпустить кишки», — сказал гендиректор «Пятницы!» Николай Картозия.
None	Белоруссия — самый легкий способ добраться до Европы для многих россиян. Через нее лежит основная автомагистраль на Польшу и дальше в Западную Европу; многие добираются до Минска и оттуда вылетают на самолете в любую точку мира. Так поступают, в частности, те, кому запрещен выезд из России (например, за долги). В 2016 году газета «Коммерсант» писала, что Москва и Минск ведут переговоры о том, чтобы закрыть эту лазейку.
None	Д — дипломатия
None	Судя по всему, сенаторам не понравились карты Coca-Cola, Pepsi CO и TripAdvisor
None	Одно из самых бессмысленных (но и самых забавных!) шапито 2016 года
None	Изобретатель года—2016
None	Оу! У нас радостный повод! Поздравляем Ильнура. Он и правда отличный текст написал — про трудовое рабство:
None	По информации «Кавказского узла», чеченцы служили в батальоне военной полиции в Ханкале.
None	Затмение было кольцеобразным — зрители могли видеть, как Луна проходит по диску Солнца. На фотографии из Северной Патагонии, составленной из серии снимков с трехминутным интервалом, показаны все фазы кольцеобразного затмения.
None	На них претендует наследница патриарха — настоятельница московского подворья одного из эстонских монастырей Александра Смирнова (игуменья Филарета)
None	Зато честно!
None	Во всех номерах граффити Бэнкси, но зато туда почти не проникает солнце — предполагается, что такая обстановка поможет израильтянам понять, как палестинцам живется со стенами
None	«Типовой крестьянский дом имел как бы три вертикальных яруса, некоторым образом напоминавших о трех мирах. Подклет (подполье) напоминал о мире недоброй, нечистой силы. &lt;...&gt; Изба напоминала о мире освоенном, земном, освященном (вспомни об иконах). &lt;...&gt; А потолок, чердак и крыша уподоблялись миру вышнему, светлому, преображенному (вспомни, что дом венчался изображением птицы — знаком Святого Духа)».Трех китов, слонов и гигантскую черепаху как-то незаслуженно забыли:
None	Повоевал и хватит
None	Если пропустили — поучительная история про немецкую семью, которая решила в Сибири спастись от уроков сексуального воспитания
None	Большой репортаж Саши Сулим с огненного заседания суда по «Кировлесу».«Вы смотрели фильм „Москва слезам не верит“? — обратился Навальный к судье. — Так вот, я как в том фильме: уважаю, но пить не буду». Политик отказался подписывать расписку, адвокаты добавили, что будут обжаловать решение суда. Сторона защиты спросила, кто будет оплачивать пребывание подсудимых в довольно дорогом отеле; Навальный поинтересовался, можно ли пользоваться мини-баром.Издевательские замечания политика судья Втюрин встретил смехом — кажется, особенно ему понравилась шутка про мини-бар.
None	У Nickelback нет чувства юмора. Казалось бы, за десятилетие издевательств Nickelback должны были привыкнуть к своей славе самой худшей в мире рок-группы после Creed (с этими вообще сложно соревноваться) и иронизировать над оппонентами, как это делает Джеймс Блант, — но нет. Nickelback неоднократно пытались с юмором отвечать на шутки в свой адрес, однако получалось всегда неловко и несмешно.
None	Расследование ФБК про секретные поместья и яхты Дмитрия Медведева вышло довольно большим, если не сказать гигантским. Но мы уже изучили его вдоль и поперек, так что готовы пересказать вам вкратце
None	Россия начала сокращать военную группировку в Сирии с «Адмирала Кузнецова» и Фонд кино обсуждают новую инициативу против западного кино и вроде как в поддержку нашего. Сэм Клебанов рассказал нашим друзьям из [club108468|КиноПоиска], что с этим не так:— Я же был на теледебатах, где участвовали Мизулина, Милонов и так далее. Они все несут какую-то ахинею, основанную на собственных представлениях о реальности, на предрассудках, но не могут подтвердить это фактами, научными исследованиями, статистикой. А им это и не надо. Они живут в мире «альтернативных фактов». Они свое мнение превращают в факты. Вот они подумают: «Ну, возьмем мы с каждого фильма по 5 млн рублей, а сколько у нас фильмов выходит? Четыреста в год? Это же 2 млрд рублей! Пусть голливудские кровососы заплатят!»
None	Поворот!
None	Одним из главных мемов конца 2016 года стало слово «русиано». Так Дмитрий Медведев в шутку предложил называть кофе американо — чтобы звучало патриотичнее. Мы не смогли удержаться и от души поддержали инициативу главы правительства
None	Мы знаем, что вы скучали по материалам про Дональда Трампа! Вот забавная шапитоха как раз подоспела
None	Сделали уточняющие карточки про новый законопроект Роспотребнадзора
