29534144	5759652	В XX веке молодой Корней Чуковский открыл свой журнал, выпустил первые четыре номера — и ему чуть не дали 8 лет каторги за «оскорбление императора Николая II».Интересная статья о том, кого и как судили за ругательства в адрес царской особы 100 лет назад
29534144	5760547	• Российской участнице «Евровидения» могут запретить въезд на Украину;• Все пассажиры разбившегося в Южном Судане самолета выжили;• Российский мультсериал вошел в число лучших в Каннах;• В Таиланде монах украл iPhone у продавца в магазинеи другие новости к этому часу
29534144	5761190	В Австралии парень для того, чтобы впечатлить девушку, прыгнул в реку с крокодилами
29534144	5761729	Разоблачение «хабаровских живодёрок», поимка педофила и травля учительницы, снимавшейся в порно — всё это произошло именно из-за активности пользователей «Двача».Ночное чтиво о том, что такое «Двач», как он устроен, что о нём говорят сами пользователи-«двачеры», и зачем вообще они занимаются травлей людей
29534144	5761907	Человек, благодаря которому вы можете загрузить концентрированную печаль себе на плеер. Традиционный #радиолентач
29534144	5762467	Сегодня человечество отмечает Всемирный день поэзии.По такому поводу вспомнили 9 известнейших рекламных роликов, навязчивые песни из которых почти невозможно забыть
29534144	5762477	Если вы всегда мечтали поиграть в LEGO «по-особенному» — у нас для вас хорошие новости  
29534144	5762945	В Японии начался сезон цветения сакуры. В этом году деревья зацвели на 5 дней раньшек р а с и в о
29534144	5763216	Милонов попросил Генпрокуратуру проверить деятельность масонских лож в России
29534144	5763479	Занимательные результаты опроса на ОТР
29534144	5763952	Немножко здравомыслия из-за океана
29534144	5764211	• Участника теракта на Дубровке приговорили к 19 годам колонии;• В США запретят провозить планшеты и ноутбуки на некоторых рейсах;• В Аргентине самолёт не мог приземлиться из-за уснувших авиадиспетчеров;• Проглотившая 900 монет черепаха по имени Банк умерлаи другие новости к этому часу
29534144	5764539	Кировчанин 4 года жил в землянке, чтобы не платить долги по алиментам
29534144	5765262	В Хабаровске оштрафовали организатора митинга, которого еще не было
29534144	5765500	• В Москве задержали главу структуры ФСО по «делу о строительстве резиденции Путина»;• Россия погасит последний внешний долг СССР;• Сбербанк уходит с украинского рынка;• Лукашенко потребовал изобрести новый источник энергиии другие новости к этому часу
29534144	5765663	Путин заявил, что средняя продолжительность жизни в России к 2025 г. может составить 76 лет. Сейчас этот показатель равен 70 годам
29534144	5765939	Официальные российские масоны из Великой Ложи России (есть и такие) ответили Милонову, который ранее обвинил масонов во вмешательстве в российскую политику. news.lenta.ch/YKxt  Ребята друг друга стоят
29534144	5766265	Британские СМИ рассказали о боевой подготовке российских футбольных хулиганов к ЧМ-2018.В качестве доказательств выложили фото кулачных боёв, которые проходили во время празднования Масленицы ¯\_(ツ)_/¯
29534144	5766565	Лентач, наш пикчер запилил для страховой компании «Согласие» серию картинок про доверие между людьми. Реальные люди рассказывают свои истории о том, какое значение доверие имеет в их жизни.  Почитать истории и поделиться своей можно тут: 
29534144	5766752	Путин призвал избавиться от хамства в регистратурах российских медучреждений
29534144	5767023	Тут потомки Стругацких признали поражение перед интернет-пиратами и выложили в открытый доступ почти все произведения своих отцов
29534144	5767250	В Госдуме предложили снижать зарплату спортсменам из российской сборной,  если они плохо выступают на международных соревнованиях
29534144	5767589	Глава МВД Франции ушел в отставку из-за скандала, связанного с трудоустройством двух его детей
29534144	5767973	Сегодня Apple презентовала красный iPhone 7, который можно будет купить уже в эту пятницу.Почитайте годную инструкцию «Как грамотно купить айфон с рук» — какими способами чаще всего обманывают покупателей, а также где, куда и на что посмотреть, чтобы не лохануться на десятки тысяч рублей
29534144	5768147	Не просто группа, а волшебное собрание гармоний.Чем громче — тем дальше от реальности.Традиционный #радиолентач
29534144	5768723	Американские археологи опубликовали 3D-реконструкцию виллы древнеримского богача
29534144	5768913	В правительстве предложили поощрять чиновников бонусами за экономию бюджета
29534144	5769203	• В Китае в результате давки у школьного туалета погибли два человека;• Россияне стали в два раза чаще покупать лотерейные билеты;• В США неизвестный выплатил ипотеку церкви в размере $4 миллионов;• В московских школах появятся безопасные точки доступа в интернети другие новости к этому часу
29534144	5769316	Депутат Госдумы попросил СК и ФСБ проверить данные о «тайной империи Медведева»
29534144	5769505	Госдума окончательно приняла закон, который разрешает не платить налоги тем, кто попал под санкции Запада
29534144	5769890	С — стабильность
29534144	5770159	В правительстве поручили поднять минимальную цену на водку до 219 рублей за 0,5
29534144	5770434	Лентач, у нас тут история от читателя.В Брянской области чиновники узнали, что вертолет Путина, который приедет с визитом в город, будет пролетать через сельхозполя, где специально по новой технологии не убирали до весны кукурузу. И урожай целиком уничтожили за день, просто "от страха лишних вопросов".Вот видео с подробностями. Если вы что-то об этом знаете (или умеете в уборку кукурузы), пишите в комменты, вместе разберемся
29534144	5770794	Виталий Кличко выпустит сборник своих высказываний.Отличный повод вспомнить лучшие
29534144	5770969	Служба безопасности Украины запретила российской участнице Евровидения Юлии Самойловой въезд в страну
29534144	5771501	• Госдума запретила денежные переводы на Украину с помощью иностранных платежных систем; • В Кирове мужчина в своей квартире взял в заложники врачей скорой помощи; • Исполняющим обязанности президента РАН назначен Валерий Козлов; • В районе строительства моста в Крым нашли голову древней скульптуры и другие новости к этому часу
29534144	5771673	Преподавателя из Красноярска уволили за показ студентам фильма Навального о владениях Медведева
29534144	5772186	Митинг Навального в центре Петербурга не согласовали, потому что на этом месте будет проводиться «культурно-массовое мероприятие, призывающее к защите и возрождению традиционных моральных и семейных ценностей»
29534144	5772466	В Лондоне у здания Британского парламента неизвестные открыли стрельбу. Сообщается о 12 пострадавшихUPD: сообщается, что нападавший застрелен
29534144	5772822	Появляются подробности теракта в Лондоне.Сообщается, что неизвестный сбил на автомобиле до 10 человек, затем вышел с мачете и убил полицейского.По другим данным нападавших было несколько
29534144	5773005	Вооруженное нападение в центре Лондона официально признали терактом. Центр города оцеплен, несколько станций метро не работает, даже знаменитое колесо обозрения «Лондонский глаз» остановили.Пока не очень понятно, сколько было террористов, но, кажется, один. Сначала он въехал на мост у лондонского парламента и начал сбивать людей.Врезавшись в ограду, мужчина вышел из авто и то ли открыл стрельбу по людям, то ли напал на прохожих с мачете. Сообщается, что один из полицейский получил смертельные ранение, сам преступник так же был убит.Число пострадавших уточняется, по последним данным речь идет о паре десятков человек.Парламент Лондона, в котором, кстати, во время нападения террориста находилась премьер Британии Тереза Мэй, закрыт. Самого премьера из здания уже вывезли.И ещё: ровно год назад, 22 марта, в Брюсселе также была совершена серия терактов. Тогда погибло 36 человек.
29534144	5773009	• В Бурятии полицейский за пытки подростка электрошокером получил условный срок; • Коммунисты предложили восстановить легитимность советских паспортов; • Китай предложил Таиланду купить три подводные лодки по цене двух; • Путин внесет кандидатуру Набиуллиной на пост председателя ЦБ на новый срок  и другие не связанные с терактом в Лондоне новости
29534144	5773013	Что известно к этому часу.— Нападавший был один. Он сбил до 10 человек на мосту, а после с помощью длинного ножа напал на одного из полицейских;— Нападавший убит несколькими выстрелами;— Официально сообщается о двух убитых и нескольких гражданах в критическом состоянии. По неофициальным данным погибло около 5 человек. Один из них упал в воду с моста;— Здание парламента заблокировано. Внутри осталось много депутатов;— Остановлено колесо обозрения. На нём до сих пор находятся люди;— Есть сообщения о работе сапёров на мосту
29534144	5773016	Доброе видео о бывшем учителе географии и бездомном (жертва квартирных мошенников), который почти каждый день проводит экскурсии по Петербургу
29534144	5773018	Мастерство опровержения
29534144	5773112	Франк-Вальтер Штайнмайер принял присягу на посту президента Германии
29534144	5773425	Лентач, у нас есть 4 билета на уникальный неоклассический концерт Миши Мищенко с Симфоническим Оркестром в Москве 30 марта, и мы готовы отдать их двум подписчикам (по 2 каждому), которые поделятся этим постом.Победители будут выбраны случайным образом 28 марта.Подробности о концерте: 
29534144	5773735	В Санкт-Петербурге митингу за отставку Медведева не предоставят Марсово Поле — в этот день там соберутся представители НОД в поддержку «традиционных семейных ценностей».Однако в штабе Навального заявили, что «такая формулировка позволяет им присоединиться к этой акции, чтобы поддержать традиционные ценности — не врать и не воровать»
29534144	5774030	• Число погибших в ходе теракта в Лондоне выросло до 4 человек; • Арестованы фигуранты дела о хищении 225 млн руб из бюджета, выделенных на строительство президентских резиденций; • Главредом «Ведомостей» станет бывший сотрудник Первого канала; • В Швейцарии поезд сошел с рельсови другие не связанные с терактом в Лондоне новости
29534144	5774784	Россияне стали в два раза чаще покупать лотерейные билеты
29534144	5774906	«House Of Balloons» от The Weeknd — легендарный микстейп с уникальным звучанием, который внёс огромный вклад в возрождение жанра R'n'B и заставил слушателей говорить о музыканте по всему миру.Традиционный #радиолентач
29534144	5775258	Борис Акунин, Василий Уткин и ещё 10 человек в рамках флешмоба #МеняНеВзяли рассказывают о том, как и куда их в своё время не взяли на работу
29534144	5775379	Днём 22 марта произошёл пожар в жилом доме на северо-востоке Москвы.   По свидетельствам очевидцев, возгорание началось на втором этаже, пламя быстро распространилось на всю девятиэтажку. Сообщается о двух погибших, ещё 19 жителям дома потребовалась медицинская помощь. В общей сложности было эвакуировано около 50 человек.   По факту происшествия уже возбуждено уголовное дело. Следователи рассматривают две основные версии возникновения пожара: техническую и бытовую. По предварительным данным, пламя вспыхнуло после взрыва газа в одной из квартир. Однако по сообщениям некоторых СМИ, газовое оборудование дома не пострадало, что исключает данную версию.   
29534144	5775444	Прекрасные новости из мира науки!Коллаборация LHCb, чей детектор обнаружил пентакварки и нашёл аномалии в ряде распадов B-мезонов, открыла пять новых частиц — возбужденных состояний очарованного омега-бариона!
29534144	5775659	• В Петербурге подожгли дверь штаба Навального; • В Харьковской области загорелся склад с боеприпасами;• Президент Филиппин разрешил кораблям ВМФ России свободно заходить в порты страны;• Количество жертв теракта в Лондоне выросло до пяти человеки другие новости к этому часу
29534144	5775934	Хороший материал о том, как устроена жизнь в монастырях. Как люди попадают в монастырь, как они там живут, бывает ли там насилие и можно ли вернуться обратно
29534144	5776341	Австрия будет платить по €1000 мигрантам, которые добровольно согласятся уехать на родину 
29534144	5776693	В сети превратили в мем свидетельницу вчерашнего теракта в Лондоне. Людей возмутило безучастие женщины, которая шла с телефоном мимо раненых и тех, кто пытался им помочь
29534144	5777044	В центре Киева расстреляли экс-депутата Госдумы Дениса Вороненкова.Ранее Вороненков сбежал на Украину из-за уголовного преследования в России. Будучи депутатом Госдумы он проявлял себя как ярый патриот, активно приветствовал присоединение Крыма к России. Но, сбежав за границу, сменил свою риторику и стал «обличать кровавый путинский режим», сравнивая его с нацистской Германией
29534144	5777573	¯\_(ツ)_/¯
29534144	5777729	Все, что известно на данный момент
29534144	5777731	Администрация Кемерова не согласовала проведение антикоррупционного митинга в городе, зато предложила альтернативную площадку неподалеку
29534144	5777734	«Да я и не болел», — сообщил премьер-мемистр Дмитрий Медведев, когда на встрече с представителями бизнеса его поздравили с выздоровлением. Ранее, 14 марта, Владимир Путин заявлял, что у главы Правительства грипп
29534144	5777736	• Убийца экс-депутата Вороненкова умер в больнице• «Исламское государство» взяло на себя ответственность за теракт в Лондоне;• Россия стала второй после США по числу утечек конфиденциальных данных;• Сроки строительства набережной у «Зенит-Арены» под угрозой срыва;и другие новости к этому часу
29534144	5777737	В Сенегале на религиозном исламском телеканале полчаса крутили жесткое порно
29534144	5777872	В Харьковской области загорелся крупнейший склад боеприпасов для артиллерии. В радиусе 10 километров эвакуированы более 20 тысяч человек. На ликвидацию последствий пожара понадобится не меньше недели
29534144	5778171	Организаторы «Евровидения» предложили российской участнице выступить по спутниковой связи.Напомним, что СБУ запретила Юлии Самойловой въезд в страну из-за того, что в 2015 году она посещала Крым
29534144	5778524	Вторая часть картинок от пикчера про доверие между людьми. Это всё в рамках специального проекта страховой компании "Согласие", в котором реальные люди рассказывают свои истории о том, какое значение доверие имеет в их жизни.  Почитать истории и поделиться своей можно тут: 
29534144	5778681	• Установлена личность совершившего теракт в Лондоне; • Медведев пообещал увеличение платы с большегрузов на четверть; • Деятельность организации «Свидетели Иеговы» приостановлена в РФ; • В Якутии водителями такси запретят нанимать мигрантов  и другие новости к этому часу
29534144	5778809	В Индии попугаи-наркоманы съели часть урожая опийного мака
29534144	5778992	Месяц назад убитого на Украине экс-депутата Госдумы Вороненкова спросили, боится ли он за свою жизнь.  Вот, что тот ответил
29534144	5779289	В Госдуме предложили повысить призывной возраст с 27 до 30 лет
