29534144	5326948	Лентач, у нас есть 4 билета на [club131926342|концерт The Pretty Reckless] в Москве, и мы готовы отдать их четырем подписчикам, которые поделятся этим постом. Победители будут выбраны случайным образом 25 января.Подробнее о концерте: 
29534144	5327116	Пора защищать русскоязычное население Вашингтона
29534144	5327361	Занятная история произошла в Петербурге.  Неизвестный попытался изнасиловать девушку в лифте, а та включила смекалочку и предложила уединиться в её квартире, где задержавшуюся дочь ждала мать.  В итоге насильник испугался рассерженной женщины и сбежал
29534144	5327597	Тут целая драма разворачивается. Артемий Лебедев вызвал Алексея Навального на теледебаты. Навальный согласился.Предложение о проведении дебатов появилось после нескольких постов, в которых Лебедев и Навальный обменялись взаимной критикой.Сначала Лебедев написал в своем блоге, что Навальный будет плохим президентом. Навальный в ответ обвинил Студию Артемия Лебедева в коррупции
29534144	5327941	• На месте крушения Boeing под Бишкеком нашли второй «черный ящик»;• В отношении Павленского возбудили уголовное дело;• Минздрав опроверг инициативу о таране не пропускающих «скорую» автомобилей;• Роскомнадзор потребует удалить пиратские копии «Шерлока» из интернетаи другие новости к этому часу
29534144	5328157	На этой неделе московский департамент национальной политики начнет распространять памятку для мигрантов. Разработка методички обошлась городским властям в 7 млн рублей.Однако эксперты утверждают, что памятка неэффективна и чиновники опять потратили деньги впустую
29534144	5328761	В Кении женщина-депутат призвала жён не давать мужьям, пока те не зарегистрируются на выборы в качестве избирателей
29534144	5329010	В одном из городков Швеции закрыли родильную палату, а до ближайшей нужно ехать минимум 100 км.Однако две акушерки не растерялись и решили открыть курсы родов в машине
29534144	5329177	• В результате случайной атаки ВВС Нигерии на беженцев погибли до 50 человек;• В Италии без света остались 300 тысяч человек;• Домашних животных в Испании благословили в честь Дня святого Антония• Британке с 50 внуками исполнилось 105 лети другие новости к этому часу
29534144	5329483	Интернет-пользователь рассказал об удивительно живучей половине карася.Зовут рыбку Джоди Плавник. После встречи с другой недружелюбной рыбой Джоди лишился нескольких важных плавников, но всё равно выжил. Он научился питаться и маневрировать в аквариуме, несмотря на проблемы с балансировкой и управлением. Очень рады за Джоди
29534144	5329678	В рамках проекта «Вместо Путина» Михаил Ходорковский запустит КВЕСТ для региональных политиков, по итогам которого участники должны стать «серьезными федеральными политиками»
29534144	5329716	За два дня до инаугурации нового президента действующий чернокожий глава государства объявил в стране чрезвычайное положение сроком на 90 дней. Он заявил о нежелании покидать пост в связи с беспрецедентным вмешательством других стран в ход выборов.Будем и дальше держать вас в курсе ситуации в Гамбии
29534144	5329823	Ровно 74 года назад советскими войсками была прорвана блокада Ленинграда
29534144	5329982	Половина американцев считает, что Россия вмешивалась в их выборы с помощью хакерских атакnews.lenta.ch/1hDY
29534144	5330306	А вы знали, что на вершине Эвереста есть Wi-Fi?Тут собрали 5 очень необычных мест, где можно подключиться к интернету (и полистать мемасики, например)
29534144	5330555	Госдума готовит поправки, согласно которым водителей могут лишать прав за «опасное вождение»
29534144	5330808	Старейшей в мире панде по кличке Басы сегодня исполнилось 37 лет
29534144	5331058	РПЦ провела обряд по освящению воды в здании парламента Петербурга
29534144	5331343	• ЦРУ опубликовало архив рассекреченных документов;• Обама смягчил приговор информатору WikiLeaks Челси Мэннинг;• Сноудену продлили вид на жительство в России еще на два года;• ФАС завела дело на губернатора Самарской области и сотрудников «Газпрома»;• Джордж Буш-старший попал в больницуи другие новости к этому часу
29534144	5331456	В Совфеде хотят обязать сенаторов спрашивать разрешения перед тем как получить иностранную награду или премию
29534144	5331714	«Единая Россия» обвинила директора Исаакиевского музея в торговле реликвиями, продаже «двойных билетов» и «иностранной гастрольной деятельности».Просят ускорить передачу собора РПЦ
29534144	5332085	Вчера ЕСПЧ признал незаконным запрет на усыновление российских детей американцами. Как был принят «закон Димы Яковлева», что постановил ЕСПЧ и какие будут последствия
29534144	5332266	Пресс-секретарь «Роснефти» ответил журналистам, почему его шеф Игорь Сечин ездит на машине с мигалкой, несмотря на запрет Путина
29534144	5332462	• В центральной части Италии произошло землетрясение магнитудой 5,4;• Крымские музеи подали апелляцию на решение суда Амстердама по скифскому золоту;• В Калифорнии хотят ввести для студентов лекции о «российском вмешательстве»;• В Финляндии открылась выставка нарисованных медведем картини другие новости к этому часу
29534144	5332642	Россиянам показали православный смартфон за 1,5 миллиона рублей.У самого Иисуса такой
29534144	5333111	Сделали вам на случай важных переговоров.В архиве варики без цензуры
29534144	5333288	Путин назвал главную задачу российской экономики
29534144	5333569	Ресторан в Сочи снизил цены для мэра города
29534144	5333892	• В Киргизии похоронили погибших при крушении «Боинга»;• Россия и Турция начали первую совместную операцию против ИГИЛ в Сирии;• Минздрав предложил ограничить рекламу шоколада, колбасы и газировки;• В Великобритании велосипедистов обвинили в загрязнении воздухаи другие новости к этому часу.А также результаты розыгрыша билетов на концерт юбилейного тура «Арконы»
29534144	5334001	Когда даже у козлов в зоопарке жизнь интереснее твоей
29534144	5334169	и мы готовы отдать их четырём подписчикам, которые поделятся этим постом. Победители будут выбраны случайным образом 25 января. Подробнее о фестивале: 
29534144	5334451	Мужика, которого обвиняли по «закону Яровой» из-за лекции о йоге, оправдали. Оказалось, что заявление на него написал местный житель, которого на этой лекции даже не было
29534144	5334751	Минздрав предложил создать сеть столовых с бесплатным диетическим питанием для бедных
29534144	5335012	Лентач, почитай занимательный материал о том, какие открытия делали советские учёные за решеткой
29534144	5335198	Боевая авиация России и Турции объединилась против ИГИЛа
29534144	5335386	ЦРУ обнародовало 12 миллионов рассекреченных страниц о том, чем они занимались с 1940 по 1990 год.Смерть Сталина, исследования телекинеза, существование НЛО и «Зоны 51», а также другие темы — тут вкратце рассказали, что там есть интересного
29534144	5335572	• В РФ могут запретить продажу алкоголя гражданам до 21 года;• Имитировавшие голос Кадырова телефонные мошенники задержаны; • Сенегал и Нигерия приготовились к военному вторжению в Гамбию;• Самолет Pegas Fly экстренно сел в Красноярске из-за засора в туалетахи другие новости к этому часу
29534144	5336010	Дональд Трамп опубликовал в Твиттере фотографию, на которой он, по его словам, пишет свою речь для инаугурации.И тут понеслось
29534144	5336117	Житель Ирландии собирает фотографии грустных собак, которые ждут своих хозяев. Если не это важные новости, то что
29534144	5336194	Сахалинская больница выплатит 1,3 млн рублей пациентке, которой они по ошибке удалили здоровую почку 
29534144	5336314	В Испании по просьбе ФБР задержали жителя Таганрога, который находился в отпуске. Официальные обвинения пока не выдвинуты, но, по словам супруги, её мужа подозревают в причастности к хакерским атакам на США
29534144	5336430	Британская антарктическая станция закрывается из-за огромной трещины во льду.Станция Халли-6 прослужила всего 5 лет и теперь закрывается, чтобы не уплыть вместе с отделяющимся ледником. Предыдущие базы Халли служили от 7 до 23 лет
29534144	5336507	В этом году выросло число зрителей новогодних телешоу
29534144	5336694	Четверо парней из Томска совершили путешествие из Питера в африканскую Гамбию. Они выехали в конце декабря и за две недели проехали 12 стран и 10 000 километров на «Жигуле», которому более 20 лет.  Banjul Challenge — испытание-благотворительное ралли, в рамках которого нужно проехать путь протяженностью 6 000 километров из Испании в Гамбию, причём большая часть совпадает с маршрутом ралли «Париж-Дакар». Парни прошли через столкновения с бандитами на границе, обыски с оружием и собаками, а в конце, как и все остальные участники испытания, они подарили свой автомобиль Гамбии.  То чувство, когда даже ржавый «Жигуль» повидал в этом мире больше, чем ты
29534144	5336946	Помните Илона Маска — миллиардера, филантропа и просто того паренька, который запускает в космос ракеты (SpaceX), выпускает электрокары (Tesla), а также планирует обеспечить абсолютно всю Землю бесплатным Wi-Fi?Так вот, он уже давно хочет создать «всемирное метро» — глобальную транспортную сеть «Hyperloop» с супербыстрыми поездами, которая охватывает всю планету — и, судя по всему, он настроен ОЧЕНЬ серьёзно.Почитайте о том, каким же образом этот Человек с большой буквы планирует осуществить такой фантастический проект и сделать его будущим человечества, которое уже вот-вот наступит
29534144	5337359	На Урале к инаугурации Трампа выпустили килограммовую серебряную медаль с AmeriKой¯\_(ツ)_/¯
29534144	5337639	• Трамп озвучил свой лозунг на выборах 2020 года;• Минфин не поддержал антитабачную концепцию Минздрава; • Пол Маккартни подал в суд на Sony из-за авторских прав на песни The Beatles;• В Италии снежная лавина накрыла отель с постояльцамии другие новости к этому часу
29534144	5337877	Сегодня исполняется 45 лет Сергею Михалку, экс-лидеру группы "Ляпис Трубецкой" и лидеру "BRUTTO".Пожалуй, #радиолентач
29534144	5338189	Московские власти закупили гирлянды для Тверской улицы по 2 000 000 рублей — в 5 раз дороже их реальной стоимости
29534144	5338559	В Италии снежная лавина сошла на один из горных отелей. Под завалом оказались до 30 человек.Сообщается о нескольких погибших, но точных сведений о жертвах нет. Сейчас спасатели занимаются поиском выживших.Лавина была вызвана землетрясением, которое произошло вечером 18 января
29534144	5338661	Наш Конституционный суд вопреки решению Европейского суда по правам человека разрешил России не выплачивать €1 900 000 000 компенсации по «делу ЮКОСа».Говорят, это единственный способ не нарушить Конституцию
29534144	5339037	Посмотрите на Камчатку в объективе Владимира Медведева — победителя конкурса BBC Wildlife Photographer of the Year.Еще фото:
29534144	5339319	Жириновский, нибалей((9
29534144	5339650	• ФБР проверяет выплаты российским пенсионерам, живущим в США;• Крупнейшие российские банки выступили против перевода бюджетников на карту «МИР»;• Правительство продлило запрет на вывоз шкур из России;• В Новосибирской области обрушилась крыша конного клубаи другие новости к этому часу
29534144	5339818	В футбольный стадион на Крестовском острове вложат еще 1,5 миллиарда рублей
29534144	5340067	Объем данных для хранения по «закону Яровой» сократят в 10 раз
29534144	5340371	Лентач, у нас необычный, но очень крутой конкурс. Ребята из [club57661549|Тату-студии "ЗАБИТЫЕ"] готовы набить вам целых 100 татуировок с изображением нашего логотипа ¯\_(ツ)_/¯ в любой части тела. Обладателями фирменных наколок станет сотня подписчиков, которые поделятся этим постом.Победители будут выбраны случайным образом 2 февраля.Также, независимо от того, победили вы или нет, каждый репостнувший получит скидку 10% на ЛЮБУЮ татуировку в [club57661549|Тату-студии "ЗАБИТЫЕ"]
29534144	5340713	Садизм, похищение, побои и убийство,  — невероятно адовая история о «традиционных ценностях» и семейных отношениях в Ингушетии
29534144	5341039	Интернет-воины ислама устроили «травлю» обзорщика игр и стримера Ильи Мэддисона.  Пару лет назад Мэддисон пошутил про Коран в одном из выступлений, сейчас эта шутка дошла до воинственных мусульман и они, по старой доброй традиции, решили заставить его извиниться.  Интересно, что среди интернет-воинов оказались дагестанский депутат Магомед Шабанов и помощник депутата Госдумы Булач Чанкалаев. Законотворцы призывают «наказать» блогера и надеются, что «недолго осталось гаду».  P.S. Шабанов во время выборов скрыл от избирательной комиссии свою судимость по статье «Групповое изнасилование»
29534144	5341711	• Эксперты правительства посчитали недопустимой отмену «закона Яровой»; • РБК подал апелляцию на решение суда по иску «Роснефти»; • Начальника уголовного розыска Нефтекамска арестовали за пытки; • В России макак начали готовить к полету на Марс  и другие новости к этому часу
29534144	5342132	Группа Gorillaz выпустила новый клип впервые за 6 лет
29534144	5342677	В Москве есть магазин «Продукты», в который люди приходят устраиваться на работу — и становятся рабами. В прямом смысле. Одной из девушек спустя 8 месяцев заточения удалось сбежать и теперь она рассказывает про это место такие вещи, от которых волосы встают дыбом
29534144	5343358	В список «существенно важных для внутреннего рынка товаров» попали берёзовые брёвна
29534144	5343928	Самка орангутана научилась пилить
29534144	5344299	• Войска Сенегала вошли на территорию Гамбии; • Медведев подвел итоги работы администрации Обамы; • Для россиян ввели безвизовый режим в ЮАР на срок до 90 дней; • В Бразилии разбился самолет, на борту которого был судья Верховного суда  и другие новости к этому часу
29534144	5345028	Смотрели «Пункт Назначения»? В Иркутской области воплотился в жизнь один из ваших самых страшных кошмаров. Грузовик на такой скорости въехал в лесовоз, что оказался нашпигованным брёвнами. Но всё обошлось, все живы
29534144	5345159	Благодаря мастерскому монтажу и невероятным музыкальным данным пёс Гейб исполнил песню группы Queen «Don't stop me now». От оригинала почти не отличить
29534144	5345291	Первый канал назвал халатность одного из сотрудников причиной слива последней серии Шерлока в сеть за день до мировой премьеры.По их словам, сотрудник без злого умысла нарушил протоколы безопасности, за что они перед всеми извиняются.Канал BBC принял извинения и дал понять, что сотрудничество будет продолжено.Кто же всё-таки воспользовался дырой в безопасности и слил серию в интернет, не сообщается
29534144	5345410	Уже сегодня Барак Обама сложит с себя президентские полномочия. Можно долго обсуждать результаты его работы, но наличие харизмы и самоиронии в 44-м президенте США вряд ли кто-то станет оспаривать.  В этом альбоме собраны самые эпичные и драматичные фотографии правления Барака Обамы
