29534144	5529309	Легендарная Nokia 3310 вернётся на мировой рынок.Да-да, ТА САМАЯ
29534144	5529557	Полицейские вломились в дом к чернокожему рэперу, перепутав его с грабителем.¯\_(ツ)_/¯
29534144	5529739	• Трамп рассчитывает на возвращение Крыма в состав Украины; • РФ тайно развернула новые крылатые ракеты высокой дальности; • В Таллине раздают бесплатные консервы; • Китайского туриста избили за отказ давать взятку и другие новости к этому часу
29534144	5529943	В ноябре 2015 года 19-летний житель Саратова в комментариях к посту на своей странице в ВК написал «Предлагаю устроить холокост ваты» (имея в виду русских).Теперь ему грозит 5 лет тюрьмы (либо штраф в полмиллиона рублей)
29534144	5530148	Группа 5'Nizza впервые за 12 лет выпустила новый альбом — «КУ»!Традиционный #радиолентач
29534144	5531003	В Австрии открылся первый в мире Bitcoin-банк.Как сегодня люди относятся к биткоинам, сколько сейчас они стоят, и какое будущее ожидает самую известную криптовалюту на Земле
29534144	5531188	Интересный материал о том, какими способами в Средневековье лечили «от любовных страданий»
29534144	5531423	• Российские десантники проведут учения с белорусскими силами спецопераций; • Минобороны РФ опровергло информацию об инцидентах с американским эсминцем; • Южная Корея проведет заседание СНБ из-за смерти брата Ким Чен Ына; • Трамп объявил о чрезвычайной ситуации в Калифорнии  и другие новости к этому часу
29534144	5531576	В Екатеринбурге хирург впервые проведет операцию в 3D-очках
29534144	5531789	Стоимость строительства новой взлётной полосы в «Шереметьево», которую делают специально для ЧМ-2018, возросла на 60% и теперь составляет 55 000 000 000 рублей.И при этом её всё равно не успеют достроить до начала чемпионата мира
29534144	5532102	Бывшая вице-спикер ульяновского Заксобрания получила взятку в размере 4,7 миллиона рублей, а затем она попалась.Суд приговорил её к штрафу в 4,8 миллиона рублей¯\_(ツ)_/¯
29534144	5532441	В Татарстане мальчик притворился спящим, когда увидел проходящих мимо президента республики и председателя Госдумы
29534144	5532687	Любовь россиян к Сталину достигла исторического максимума за 16 лет
29534144	5533043	Кремль под своим брендом «Кремлёвское качество» будет выпускать бакалею и молочную продукцию
29534144	5533470	Помните якутского скульптора, который лепил символы года из навоза?Так вот, теперь он добрался до Ждуна
29534144	5533887	• Владимир Путин принял отставку действующего губернатора Карелии; • Папа Франциск призвал сохранить христианские традиции в Европе; • В Рособрнадзоре рассказали об изменениях в проведении ЕГЭ в 2017 году; • Уоррен Баффет заработал больше $1 млрд за 6 недель  и другие новости к этому часу
29534144	5534011	МИД РФ анонсировал проект по разоблачению «фейковых» новостей в иностранных СМИ
29534144	5534172	И это депутат Государственной думы
29534144	5534816	Хорошие новости, Лентач! В Екатеринбургском зоопарке разработали курс енототерапии для детей с инвалидностью
29534144	5535264	В Казахстане пилот посадил военный вертолет на трассу, чтобы спросить дорогу у водителей
29534144	5535704	Активисты «НОД» устроили акцию против Трампа и Киселева возле здания «России Сегодня».Похоже, вселенная скоро схлопнется
29534144	5536142	Россия заняла 114-е место в рейтинге экономической свободы
29534144	5536549	В РПЦ теперь пишут колонки под названием «Место хулителей Путина у параши». Такие дела
29534144	5536875	• Доминиканских журналистов убили в прямом эфире;• В России впервые создадут целевой капитал для борьбы с детским раком;• В США хотят экранизировать «Мастера и Маргариту» Булгакова;• В Нидерландах начались испытания светофоров для смартфонозависимых;и другие новости к этому часу
29534144	5537127	Милонов извинился за «не слишком удачную» фразу о варившихся в котлах христианах 
29534144	5537430	Занимательный материал про то, как развивали детей в 1930-х годах, до появления этих ваших конструкторов, наборов для творчества и прочей лабуды.  пару картофелин и чувство прекрасного, можно достичь таких вот высот в искусстве поделок:
29534144	5537719	Если вы думаете, что у вас ужасно маленькая квартира — посмотрите на фотографии «жилищ» этих людей из Гонконга.  Из-за кризиса, малой площади Гонконга и высоких цен на то жильё, которое есть, многие местные жители были вынуждены переселяться в более дешёвые — и ОЧЕНЬ крохотные... даже не квартиры, а «места для того, чтобы переночевать».  Например, мистер Вонг уже более 20 лет живёт в одном из таких, как сами местные их называют, «домов-гробов» — жестяной коробке площадью 2 квадратных метра. Да-да, вы всё правильно прочитали. И в этих двух квадратных метрах нужно уместить все вещи, которые нужны для максимально комфортной жизни (хотя назвать её таковой очень сложно). Из-за всех этих вещей мистер Вонг даже не может просто взять и вытянуть ноги, не говоря уже о влиянии такого «гроба» на психику человека.  И это ещё не всё — за это «жильё» он ежемесячно платит 225 долларов (13 000 рублей). 2 года назад он подал заявку властям на то, чтобы его переселили в общежитие, где хоть немного попросторнее, однако ответа до сих пор не получил — и неизвестно, будет ли этот ответ вообще.  Более 7 000 000 человек называют Гонконг «своим домом». И правительство планирует построить в ближайшее десятилетие более 460 000 квартир. Но до этого момента ещё нужно дожить. Официальные данные говорят, что людей вроде мистера Вонга — более 200 000 человек, но реальная цифра наверняка в разы больше.  Проблема жилья для бедных людей в Гонконге всегда была очень больной темой. Например, эти «дома-гробы» — ещё не самое худшее, что может быть. Многие люди не могут себе позволить даже такого подобия жилья, поэтому селятся в клетках. Да, именно в клетках.  Посмотрите сами на фотографии тех, кому не повезло быть бедным в Гонконге — финансовой столице всего мира
29534144	5537971	Во вторник ДНР выдворила гражданского активиста-трансгендера Серое Фиолетовое (известного как Олег Васильев и Маша Штерн).Его вместе со спутницей в конце января задержали при попытке пересечения границы ДНР, чтобы затем провести там художественную акцию в поддержку ЛГБТ.«Медуза» взяла у него интервью и узнала, почему Серое Фиолетовое хотело провести эту акцию именно на территории ДНР, и в чём же заключалась её суть
29534144	5538131	• Уехавшего на Украину коммуниста Вороненкова объявили в федеральный розыск;• Роскомнадзор заблокировал 1300 сайтов, призывающих детей к суициду;• ОАЭ собираются построить город на Марсе;• К страдающих деменцией британцам привезли пингвинови другие новости к этому часу
29534144	5538299	Если хочется энергии и движения — включайте Battle Tapes.Эти бородачи из Лос-Анджелеса пишут музыку в жанре «Электро-рок», их композиции буквально «дышат» бешеным ритмом городской жизни. Наверное, именно поэтому их треки взяли в GTA V и Need for Speed, что и сделало парней популярными.Традиционный #радиолентач
29534144	5538596	Смотрите, какой крутой бесплатный капремонт делают для некоторых хрущёвок в Калининграде
29534144	5538738	В Сочи вчера бушевал шторм.Наш подписчик нырнул в эпицентр стихии и принёс оттуда фотографий
29534144	5538884	Объявлены победители конкурса Underwater Photographer of the Year за лучшие подводные фотографии
29534144	5539269	Существует ли связь между уровнем интеллекта и такими вещами, как мат, алкоголь, и рок-музыка?Учёные выяснили — да, ещё как существует
29534144	5539453	Почитайте о том, как в Сингапуре будут прививать любовь к литературе
29534144	5539749	Кадыров подвел итоги десяти лет работы главой Чечни
29534144	5539878	• Бывшего депутата Госдумы Михеева объявили в федеральный розыск;• Закон о надбавках к пенсиям для сенаторов одобрили в правительстве;• В Красноярском крае хотят запретить продажу алкоголя по пятницам;• Абитуриенты столкнутся с нехваткой бюджетных мест после 2020 годаи другие новости к этому часу
29534144	5539983	Пенсионер из Новосибирска построил самолет из дерева и даже летал на нем все прошлое лето, но недавно к нему пришла транспортная прокуратура и все запретила
29534144	5540275	Больше половины заблокированных Роскомнадзором сайтов продолжают работать¯\_(ツ)_/¯
29534144	5540531	В Общественной палате предложили красить метиловый спирт во избежание отравлений
29534144	5540921	Семилетняя девочка из Великобритании вместе с отцом написала письмо в Google, и попросила её взять туда работать, потому что их офис — это идеальное рабочее место и вообще она хочет «сидеть в креслах-мешках, спускаться с горок и кататься на картах», любит компьютеры и роботов. Ответ она получила через несколько дней от генерального директора, который  поблагодарил её за письмо и предложил отправить резюме после окончания школы.
29534144	5541222	Очень смешная история. Депутат Госдумы РФ от КПРФ Денис Вороненков, не получив мандат после прошедших выборов, вместе с женой-единороссом (и уголовным делом) свалил в Киев, где начал рубить правду-матку про путинский кровавый режим. Вот это вот всё "Крым взяли силой" и "Ситуация в России сейчас, как в нацистской Германии Гитлера". По его словам, на Украине их с Марией приняли «прекрасно», дали гражданство и сразу начали брать многочисленные интервью. Nuff saidГод назад Вороненков был образцовым патриотом и приветствовал полуостров в родной гавани. [club24946565|Варламов] собрал его прошлые высказывания в удобную инфографику
29534144	5541544	Фотограф сделал клёвую галерею снимков Гендальфа на фоне Средиземья — таким образом он хотел объединить все снимки пейзажей Новой Зеландии одной тематикой. Стать Гендальфом он просил прохожих, которых встречал по пути
29534144	5541730	• В Воронеже экс-гитариста «Сектора газа» сбила машина; • На Ставрополье запретили продажу вейпов несовершеннолетним;• Власти Москвы согласовали проведение «Марша Немцова»;• Католическая церковь Австралии выплатила более 200 млн долларов жертвам педофилиии другие новости к этому часу
29534144	5541796	Суд признал сообщения о пытках в ИК-5 Нижнего Тагила «порочащими деловую репутацию колонии»
29534144	5541967	Хэй, Лентач! ЭТО ОЧЕНЬ ВАЖНОЕ ОБЪЯВЛЕНИЕ! Мы решили обновить логотип, поэтому просим вас нам помочь. Тут открыт альбом, куда можно набрасывать варианты:  на лого обязательно должно быть название паблика и желательно, но не обязательно - наш фирменный смайл ¯\_(ツ)_/¯  РАЗБУДИ В СЕБЕ ДЕСИГНЕРА!
29534144	5542132	Путин заявил, что за прошлый год ФСБ раскрыла более 400 иностранных шпионов
29534144	5542278	Оказалось, что причиной для обвинения Соколовского стало сравнение Иисуса с редким покемоном и зомби
29534144	5542519	Что делать, если вы должны банку, но задержали выплаты — полезный материал о том, как банки до обращения к коллекторам работают с теми, кто не возвращает деньги 
29534144	5542644	20 000 жителей поселка Новосинеглазово, который относится к Советскому району Челябинска, узнали, что их не существует.Местные активисты хотели организовать комитет самоуправления, но оказалось, что по документам Новосинеглазово просто нет 
29534144	5542850	• Белоруссия начала закупки иранской нефти вместо российской; • Лавров начал первую встречу с новым госсекретарем США; • Против организатора «марша» тракторов возбудили уголовное дело; • Правительство одобрило законопроект о блокировке «зеркал» сайтов и другие новости к этому часуа также результаты розыгрыша на концерт большого босса из Майами — Rick Ross
29534144	5542941	РПЦ рассматривает вопрос о передаче ей объектов Андроникова монастыря. В частности, там музей имени Андрея Рублева
29534144	5543205	Федор Емельяненко заявил, что на ринге он всегда сражается во имя Христа
29534144	5543586	Как отличить «джихад» от «священной войны», как религии относятся к пацифистам, и можно ли убивать с именем господа на устах?Священник, мулла и раввин спорят о том, чья религия справедливее всего, когда речь идёт о войне
29534144	5543913	В каких регионах РФ самые дешёвые и самые дорогие квартиры, и сколько зарплат нужно, чтобы их купить — полезная инфографика для тех, кто подыскивает себе доступное жильё
29534144	5544075	• На Украине возбудили дело против Захара Прилепина; • Трамп заявил, что хочет поладить с Россией; • Роскомнадзор заставил «Дождь» удалить новость о самоубийстве женщины;• Американец случайно пожертвовал рубашку со спрятанной заначкой и другие новости к этому часу
29534144	5544168	Может ли музыка быть одновременно успокаивающей и возбуждающей? Может, если это Hurts. Британский дуэт, основанный в 2009 и состоящий из Тео Хатчкрафта и Адама Андерсона, исполняет музыку в жанра синтипоп, способную ввести вас в транс. Традиционный #радиолентач
29534144	5544695	Лентач, начни своё утро с теста!Пройди его и узнай, насколько хорошо ты разбираешься в истории химии
29534144	5544774	Аква-гимнастика для кошек или терапия стволовыми клетками для болонок — почитайте о сети современных ветеринарных клиник в США и Канаде, которая проводит эти и другие процедуры для лечения домашних любимцев
29534144	5544925	«Диссернет» нашел плагиат на 56 страницах из 57 в приговоре Навального. Да, всего одна оригинальная страница 
29534144	5545116	В японском поселении Кавадзу зацвела сакура.Обычно деревья начинают цвести в конце марта — начале апреля, но здесь они расцветают раньше
29534144	5545307	• При теракте в мечети в Пакистане погибли 72 человека, включая 30 детей;• Руководителя Samsung арестовали по делу о взятках;• Хабаровские живодерки признали свою вину;• Россия до лета погасит все долги СССРи другие новости к этому часу
29534144	5545472	Патриарх Кирилл назвал передачу Исаакия РПЦ «символом примирения народа»
29534144	5546211	Минкульт обязал студию Алексея Учителя переснять фильм про атамана Ермака, на который из бюджета дали 35 млн рублей, или же вернуть деньги.Бюджет выделялся на фильм, который должен был рассказывать о школьнике, который выходит на след клада Ермака, однако в итоге получилось кино про артиста Ермака Мышкина, который едет из Санкт-Петербурга в Москву на пробы в мюзикле.«Дети против волшебников» и «Взломать блогеров» Минкульт переснимать все еще не просит
29534144	5546766	Очень неловкая ситуация.На днях в Минздраве заявили, что там не закупают гомеопатии и вообще покупают лекарства только из списка жизненно необходимых. Но если зайти на сайт госзакупок, все не так однозначно
29534144	5547171	• Защита Навального обжаловала новый приговор по делу «Кировлеса»;• У россиянина отобрали права на домен «ɢoogle» из-за спора с Google;• «Почта России» в 2017 году планирует повысить тарифы;• Ученые выяснили, что пчелы ухают со страха и другие новости к этому часу
29534144	5547428	Помните как активиста из Чувашии судили за репост фотографии депутата Виталия Милонова в футболке с надписью «Православие или смерть»? Так вот, теперь его судят за репост нашего поста о том, как его судили за репост¯\_(ツ)_/¯
29534144	5548085	Российские ученые научились определять тяжесть стресса по волосам
