29534144	6047494	Киберспорт внесли в список видов спорта, развиваемых на общероссийском уровне, приравняв его к хоккею, футболу и теннису
29534144	6048120	И к другим новостям
29534144	6048726	В Екатеринбурге пенсионерку задержали и доставили в отделение полиции ЗА КРАЖУ ПРОДУКТОВ В МАГАЗИНЕ.В отделении ей стало плохо, а через два дня она скончалась в больницеUPD: Сама ситуация произошла весной прошлого года, а прокуратура решила проверить действия полиции только сейчас
29534144	6049852	• В КНДР заявили о готовности нанести ядерный удар по США;• Минобрнауки займется организацией детского отдыха;• Российским военным в Сирию доставят несколько тысяч куличей;• В США на три пожизненных срока осудили женщину, пугавшую свою внучку в образе ведьмыи другие новости к этому часу
29534144	6050471	Вчера правительство опубликовало декларации о доходах госслужащих. Держите рейтинг самых богатых российских чиновников
29534144	6050971	В районе Рашидин под Аллепо произошел терракт. На текущий момент известно о 70 погибших и 130 раненых.Террористы привели в действие бомбу рядом с колонной автобусов, на которых эвакуировали жителей двух шиитских сел в провинции Идлиб
29534144	6051187	В сети появилось видео с места теракта
29534144	6051557	Пройди тест и узнай, кто умнее — ты или семиклассник
29534144	6052027	Сегодня в Северной Корее отмечают один из самых главных ежегодных праздников страны — «Праздник Солнца». Ровно 105 лет назад родился Ким Ир Сен, который со своим сыном Ким Чен Иром и внуком Ким Чен Ыном сделал КНДР такой, какая она есть сейчас. В 2015 году режиссёр Виталий Манский со съемочной группой поехал в КНДР, чтобы снять фильм о жизни в Северной Корее глазами обычной 8-летней девочки.  Фильм снимался под контролем властей КНДР — они рассчитывали, что в нём будет представлен пропагандистский образ счастливой семьи. Однако Манский тайно снимал дополнительный материал, который вместе со своими комментариями и включил в финальную версию фильма под названием «В лучах солнца».В 2017 году этот фильм получил премию «Ника» в номинации «Лучший неигровой фильм»
29534144	6052473	В РПЦ поддержали введение в школах православного меню
29534144	6053258	Старейшая жительница Земли — Эмма Морано — умерла сегодня в возрасте 117 лет.  Она родилась 29 ноября 1899 года, застала три столетия, пережила две мировых войны и более 90 итальянских правительств
29534144	6054000	Ishome, она же Мирабелла Карьянова, родилась 12 декабря 1990 года в России, городе Находка, выросла в Краснодаре.Она создает интересную электронную музыку с неземной энергетикой, качественным исполнением и яркими нотками таланта.Традиционный #радиолентач
29534144	6055431	Христос Воскрес!
29534144	6056131	В Турции проходит референдум о расширении полномочий президента.Если большинство проголосует «за», Эрдоган сможет распускать парламент и назначать судей. Президентский срок в Турции составляет 5 лет. Управлять страной можно максимум два срока подряд. Однако, если референдум пройдёт успешно, все годы управления Эрдоганом обнулятся и он сможет снова переизбраться на два срока: с 2019 по 2029 годы
29534144	6056592	Канадское правительство приняло закон, направленный на полную легализацию марихуаны к июлю 2018 года
29534144	6056649	Как знал
29534144	6057118	В Питере вооруженный мужчина напал на кафе, потребовал приготовить ему три шавермы, дождался заказа, забрал его и ушёл
29534144	6057784	И вновь к новостям ботаники.19 гектаров, 100 тысяч растений — в Калифорнии появится одна из самых крупных в мире легальных ферм марихуаны
29534144	6058261	В Петербурге задержано около 50 участников «прогулки новой оппозиции».По словам очевидцев, какой-либо символики, плакатов или лозунгов у активистов не было
29534144	6058796	По предварительным подсчётам, почти 60% турков проголосовали за радикальное расширение полномочий президента Турции.Согласно этим изменениям в законодательстве, один человек может занимать пост президента два срока подряд, а нынешний президентский срок Эрдогана из-за проведения референдума обнулится.Таким образом, Эрдоган сможет оставаться президентом до 2029 года
29534144	6059387	τаρ'ищи, η пρ100 πзδ''''ц
29534144	6060220	Несколько лайфхаков и советов для родителей о том, как сохранять спокойствие и не взорваться, когда их «прелестный цветок жизни» в очередной раз начнёт убивать их нервные клетки.Полезно почитать и тем, у кого уже есть дети, и тем, кто ещё ни разу в жизни не видел те самые 2 полоски
29534144	6060827	В YouTube нашли скрытую функцию перехода на новый дизайн.В нём есть переключатель на ЧЁРНУЮ версию
29534144	6061256	Пол Окенфолд — легендарный британский диджей и один из пионеров транс-музыки. Написал саундтреки к таким легендарным фильмам, как «Матрица», «Пароль "Рыба-Меч"», «Умри, но не сейчас», а также многим культовым видеоиграм. Сделал ремикс на песню группы «Кино» — «Перемен». Также неравнодушен к треку «Ressurection» российской группы ППК, который нередко можно услышать на его выступлениях. В свои 53 года продолжает взрывать танцполы по всему миру и радовать интересными работами. Традиционный #радиолентач
29534144	6062102	Подборка необычных библиотек в США, которые выдают не только книги.Например, в одном из штатов есть библиотека семян
29534144	6062211	Начни своё утро с материала о том, зачем люди в традиционных обществах испокон веков женятся и выходят замуж за своих родственников
29534144	6062628	Работники посольства США в Лондоне вызвали на допрос трехмесячного младенца из-за подозрения в терроризме 
29534144	6062916	• В Томске сделали замечание учителю, прочитавшему лекцию о вреде либерализма; • На Камчатке пенсионерка заплатила «экстрасенсу» 2,7 млн рублей за лечение дочерей от бесплодия; • ПДД изменят в пользу мотоциклистов; • Американские ученые создали самовосстанавливающееся стекло для смартфонов и другие новости к этому часу
29534144	6063038	Советник Путина заявил, что экономика будет расти, если «поступать, как предписано Иисусом»
29534144	6063813	Количество россиян, которые отрицательно относятся к Трампу, выросло с 7 до 39% за месяц
29534144	6064255	Anacondaz выпустили новый клип на песню "Спаси, но не сохраняй". Норм так
29534144	6064693	• Генпрокуратура начала проверку после публикаций о похищении геев в Чечне;• Суд принял иск Усманова к Навальному;• Путин подписал закон об ужесточении наказаний болельщикам;• Глава Свердловской области отправлен в отставкуи другие новости к этому часу
29534144	6064952	Навальный выпустил ролик-опровержение на заявление Усманова о том, что тот не давал взяток Медведеву.Неделю назад Алишер Усманов дал интервью "Ведомостям", где заявил, передача земельного участка около поселка Знаменское фонду под управлением однокурсников Медведева не была взяткой. Усманов заявил, что обменял свой участок, на аналогичный участок во владении фонда "Соцгоспроект". Но судя по видео, не все так однозначно
29534144	6065416	Смотрите, как Артемий Лебедев оценил наш новый логотип, который вы нам придумали 
29534144	6065573	Оказывается, позиция Киселева НЕ ВСЕГДА совпадает с мнением Кремля
29534144	6066061	Тем временем депутат Госдумы Наталья Поклонская никак не оставит в покое ЕЩЁ НЕ ВЫШЕДШИЙ фильм «Матильда» про Николая II.Внезапно нашлись эксперты, которые по просьбе Поклонской решили, что фильм «не может не оскорблять религиозные чувства христиан».А сама Поклонская нашла в картине «совмещение религиозного высокоценного с вульгарно-сексуальным». Результаты экспертизы она уже отправила в СК и Генпрокуратуру с требованием не выпускать фильм в прокат
29534144	6066738	У нас тут дикая история о молодом человеке из Питера, которого местные полицейские задержали за «странную позу», а потом случайно «нашли» у него пакетик со спайсом. Выяснилось, что парень просто страдал шизофренией.Как итог — смерть в СИЗО от патологии сердца, которую тюремные врачи не смогли выявить в срок. И «галочка» в статистику раскрытых преступлений ценой в жизнь
29534144	6067035	• Задержан один из организаторов теракта в Петербурге;• Google выплатит Федеральной антимонопольной службе РФ 439 миллионов рублей; • Обязательный прием карт «Мир» в торговых точках намерены отложить; • Секретный доклад Хрущева о культе личности Сталина продадут с аукционаи другие новости к этому часу
29534144	6067510	В РПЦ призвали прихожан молиться при посещении храма, а не делать сэлфи.Говорят, «теряется смысл богослужения»
29534144	6068088	В Краснодаре мужика исключили из казачьего войска за то, что он выступил против властей и поддержал Навального.Сам он говорит, что три года назад готов был умереть за Путина, но теперь разочаровался в нем
29534144	6068480	В Подмосковье местный изобретатель вручную собирает электромотоциклы, которые наравне с бензиновыми участвуют в соревнованиях.  А всё началось с того, что когда-то мужчина сделал для своего ребёнка маленький электрический велосипед
29534144	6068831	В начале апреля «Новая газета» опубликовала расследование про убийства геев в Чечне, после чего в адрес журналистов посыпались оскорбления и открытые угрозы о грядущей расправе.Сегодня власти Чечни заявили, что готовы встретиться с журналистами «Новой», если они выполнят одно условие.Они должны извиниться
29534144	6069198	Продюсер из Ростова-на-Дону анонсировал съёмки апокалиптического сериала с рабочим названием «Большое космическое путешествие казаков с армянами» по мотивам романа «Тихий Дон».По сюжету фильма, в будущем разворачивается атомная война, «и тогда из подпространства появляются казаки». Ну а в конце первого сезона анонсирована «армянская свадьба в космосе» даже знаем, что это будет за жанр:
29534144	6069744	• Авиакомпания «Победа» не пустила на рейс ребенка с ДЦП и его мать;• Росгвардия оснастит спецмашины пушками;• Женщина в пижаме ограбила шесть банков в США; • В Турции проходят акции протеста против итогов референдумаи другие новости к этому часуа также результаты розыгрыша билетов на концерт LP
29534144	6070177	Bruno Mars — молодой и талантливый хитмейкер с Гавайских островов.С самого детства он начал осознавать своё жизненное предназначение, разъезжая по острову вместе с родителями и четырьмя братьями и сёстрами, исполняя песни Майкла Джексона, Элвиса Пресли и других известных музыкантов.Сейчас Bruno обладатель 5-ти наград Грэмми, а его треки крутят самые знаменитые клубы и они слышны буквально на каждом углу.Традиционный #радиолентач
29534144	6071730	Журнал Forbes опубликовал карту, на которой показано количество миллиардеров в каждой стране мира.Сколько всего в мире миллиардеров, в какой стране их больше всего, как они получили столько денег, и сколько миллиардеров из России получают доход благодаря добыче нефти/газа/леса и политическим связям
29534144	6071897	Искусственный интеллект нечаянно «заразился» от людей расизмом и сексизмом
29534144	6072064	Сегодня в утреннем эфире YouTube-канала Навальный LIVE главред паблика Лентач поговорил с юристом ФБК Любовью Соболь и лидером дальнобойщиков Андреем Бажутиным о протестах, выдвижении Евгения Ройзмана в губернаторы и декларациях Путина, Медведева и Кадырова.
29534144	6072758	Сегодня исполняется 100 лет со дня рождения Георгия Вицина.Давайте вместе вспомним лучшие фильмы и роли великого актера
29534144	6073058	• «Гайд-парк» в Томске перенесли в промзону после митинга 26 марта;• В Туве завели дело о хищении 57 млн рублей на жильё для сирот;• Facebook упростит подачу жалоб на публикации после трансляции убийства;• Почти 300 человек погибли и 1000 получили ранения во время водного фестиваля в Мьянме и другие новости к этому часу
29534144	6073514	Дорожники Новосибирска отремонтировали яму, годовщину которой недавно отпраздновали местные жители.Но там уже появилась новая лужа
29534144	6073854	Последний претендент на пост мэра Омска снял свою кандидатуру с выборов. Изначально заявки подавали 23 человека
29534144	6073991	Депутат из Ленинградской области задекларировал участок на Марсе и пять звезд
29534144	6074440	Две трети россиян все еще считают, что присоединение Крыма принесло больше пользы, чем вреда
29534144	6074986	В УФАС заявили, что нужно переделать ряд работ на стадионе «Крестовский». А значит, будут новые госконтракты
29534144	6075330	Большинство митингующих, арестованных 26 марта, уже вышли на свободу. Однако не всем участникам антикоррупционных митингов повезло отделаться административными наказаниями.Что известно об активистах, на которых завели уголовные дела
29534144	6075680	• Предполагаемый организатор теракта в Петербурге не признал свою вину;• Дадаев заявил, что дал признательные показания об убийстве Немцова под давлением;• Более половины россиян с долгами берут новые кредиты, чтобы погасить старые;• В Мексике игравший Иуду актер случайно повесился во время пасхального спектакляи другие новости к этому часу
29534144	6075824	С 1 января в Пермском крае действует закон, согласно которому некоторые молодые мамы имеют право на получение единовременной выплаты в 60 тыс. рублей.Однако этот закон не распространяется на матерей-одиночек с детьми, у которых не установлено отцовство.Местный депутат объяснил, почему эти мерзкие внебрачные дети не заслуживают поддержки
29534144	6076200	В Генпрокуратуре заявили, что коррупцию на дорогах провоцируют сами водители.Предлагают, понимаете ли, свои грязные взятки, а безвольные наивные сотрудники ГИБДД ведутся на эту подлость
29534144	6076794	Пакетик сычуаньского соуса из «Макдоналдс», произведённый в 1998 году, был продан на eBay за $15 тысяч 
29534144	6077126	• Навальный собрал 300 тысяч подписей для выдвижения кандидатом в президенты;• При крушении полицейского вертолета в Турции погибли 12 человек;• Реальные доходы россиян в марте снизились на 2,5%;• В США преступник сбежал из тюрьмы и спрятался в вентиляции, но застрял и вызвал спасателейи другие новости к этому часуа также результаты розыгрыша билетов на концерт группы «Браво»
29534144	6077398	Необычный проект для российского рынка рекламы – ведущие режиссеры-аниматоры сделали сериал в жанре документального мультфильма. Получилась своеобразная энциклопедия современной отечественной анимации. Сегодня вышла новая (и очень классная) серия о драках в хоккее. Всего серий будет 12. Смотреть их можно на ютуб-канале: 
29534144	6077766	Первый твит в официальном аккаунте Зенит-арены начался с цитаты Бродского «Умеющий любить, умеет ждать». стадион тоже напомнил о некоторых афоризмах
29534144	6078075	Генпрокурор Юрий Чайка предложил не наказывать организации, признавшиеся в коррупции
29534144	6078342	Был бы человек, а статья найдётся.  И чаще всего это статья об экстремизме.Держите подборку самых экстремистских дел: от публикации материала об экологических проблемах Адыгеи до публикации исследований однополого секса малых народов
